id1,name1,namepossessive1,imageA1,imageB1,imageC1,country1,gendergroup1,bio1,quote1,id2,name2,namepossessive2,imageA2,imageB2,imageC2,country2,gendergroup2,bio2,quote2,id3,name3,namepossessive3,imageA3,imageB3,imageC3,country3,gendergroup3,bio3,quote3,id4,name4,namepossessive4,imageA4,imageB4,imageC4,country4,gendergroup4,bio4,quote4,id5,name5,namepossessive5,imageA5,imageB5,imageC5,country5,gendergroup5,bio5,quote5
birdie,Birdie,Birdie's,http://web.mit.edu/pmwh/www/enfreakment-images/clean/sfv_cs_birdie.jpg,http://web.mit.edu/pmwh/www/enfreakment-images/clean/sfv_oa_birdie.jpg,http://web.mit.edu/pmwh/www/enfreakment-images/clean/sfv_ig_birdie.jpg,United Kingdom,men,"With a history that dates back to the original Street Fighter, Birdie’s appearance has changed dramatically over the years. He’s gone from being a muscular brute in the Alpha series to a beer bellied glutton in Street Fighter V.","Oi! It ain't too late to run home to Mum, now!",laura,Laura,Laura's,http://web.mit.edu/pmwh/www/enfreakment-images/clean/sfv_cs_laura.jpg,http://web.mit.edu/pmwh/www/enfreakment-images/clean/sfv_oa_laura.jpg,http://web.mit.edu/pmwh/www/enfreakment-images/clean/sfv_ig_laura.jpg,Brazil,women,"Laura is a brand-new Street Fighter character and a practitioner of Matsuda jiu-jitsu. If you recognize the name Matsuda, it's because Laura is the elder sister of Sean from Street Fighter III.","Boom! That's how to start a fight and finish it quickly!",balrog,Balrog,Balrog's,http://web.mit.edu/pmwh/www/enfreakment-images/clean/sfv_cs_balrog.jpg,http://web.mit.edu/pmwh/www/enfreakment-images/clean/sfv_oa_balrog.jpg,http://web.mit.edu/pmwh/www/enfreakment-images/clean/sfv_ig_balrog.jpg,United States of America,men,"As one of the four kings of Shadaloo, Balrog is a remorseless boxer who loves money, women, and bourbon. As long as Shadaloo continue to provide him with all three, he will fight for them.","There's no escape!",king,King,King's,http://web.mit.edu/pmwh/www/enfreakment-images/clean/tk7_cs_king.jpg,http://web.mit.edu/pmwh/www/enfreakment-images/clean/tk7_pr_king.png,http://web.mit.edu/pmwh/www/enfreakment-images/clean/tk7_ig_king.jpg,Mexico,men,"King is not only a masked professional wrestler, but also the proud owner of an orphanage. Recently, King's sworn friend and comrade, Craig Marduk, as well as the man King called his master, both engaged in a bloody fight which left them with critical injuries. King desperately wanted to come to his friends' rescue, but knew that their operations wouldn't come cheap. At the same time, King's orphanage was in constant danger owing to the war that raged between G Corporation and the Mishima Zaibatsu. Finding himself caught between a rock and a hard place, King entered the King of Iron Fist Tournament with his eyes set firmly on the cash prize.","Let's do this.",bryan,Bryan Fury,Bryan's,http://web.mit.edu/pmwh/www/enfreakment-images/clean/tk7_cs_bryan.jpg,http://web.mit.edu/pmwh/www/enfreakment-images/clean/tk7_pr_bryan.png,http://web.mit.edu/pmwh/www/enfreakment-images/clean/tk7_ig_bryan.jpg,United States of America,men,"A savage fighter who uses a kickboxing fighting style. He's reported to have died twice and was somehow revived each time. He once belonged to an international police force, but Dr. Abel and Dr. Bosconovitch made him a replicant with a perpetual generator that keeps him alive.","Mwahahahaha! So, which one of you wants to die?"
f_a_n_g,F.A.N.G,F.A.N.G.'s,http://web.mit.edu/pmwh/www/enfreakment-images/clean/sfv_cs_f_a_n_g.jpg,http://web.mit.edu/pmwh/www/enfreakment-images/clean/sfv_oa_f_a_n_g.jpg,http://web.mit.edu/pmwh/www/enfreakment-images/clean/sfv_ig_f_a_n_g.jpg,China,men,"Rounding off the quartet of new combatants in Street Fighter V is F.A.N.G. This assassin works for Shadaloo as M. Bison’s second in command.","Two minutes! I'll finish you in two minutes!",king,King,King's,http://web.mit.edu/pmwh/www/enfreakment-images/clean/tk7_cs_king.jpg,http://web.mit.edu/pmwh/www/enfreakment-images/clean/tk7_pr_king.png,http://web.mit.edu/pmwh/www/enfreakment-images/clean/tk7_ig_king.jpg,Mexico,men,"King is not only a masked professional wrestler, but also the proud owner of an orphanage. Recently, King's sworn friend and comrade, Craig Marduk, as well as the man King called his master, both engaged in a bloody fight which left them with critical injuries. King desperately wanted to come to his friends' rescue, but knew that their operations wouldn't come cheap. At the same time, King's orphanage was in constant danger owing to the war that raged between G Corporation and the Mishima Zaibatsu. Finding himself caught between a rock and a hard place, King entered the King of Iron Fist Tournament with his eyes set firmly on the cash prize.","Let's do this.",jin,Jin Kazama,Jin's,http://web.mit.edu/pmwh/www/enfreakment-images/clean/tk7_cs_jin.jpg,http://web.mit.edu/pmwh/www/enfreakment-images/clean/tk7_pr_jin.png,http://web.mit.edu/pmwh/www/enfreakment-images/clean/tk7_ig_jin.jpg,Japan,men,"The leader of the Mishima Zaibatsu and the man who declared war on the world. Fighting the Devil inside him which gets stronger everyday, he yearns to be rid of it once and for all. When his battle is over at last, will he find hope… or despair?","Power is everything.",menat,Menat,Menat's,http://web.mit.edu/pmwh/www/enfreakment-images/clean/sfv_cs_menat.jpg,http://web.mit.edu/pmwh/www/enfreakment-images/clean/sfv_oa_menat.jpg,http://web.mit.edu/pmwh/www/enfreakment-images/clean/sfv_ig_menat.jpg,Egypt,women,"Making her Street Fighter debut, Menat is the apprentice of a famous fortune-teller. She fights with a crystal sphere that she controls with her soul power.","Have you considered your destiny? Do you believe in fate?",lee,Lee Chaolan,possessive,http://web.mit.edu/pmwh/www/enfreakment-images/clean/tk7_cs_lee.jpg,http://web.mit.edu/pmwh/www/enfreakment-images/clean/tk7_pr_lee.png,http://web.mit.edu/pmwh/www/enfreakment-images/clean/tk7_ig_lee.jpg,Japan,men,"The adopted son of Heihachi Mishima, raised to be a rival for Kazuya Mishima. After abandoning the Zaibatsu for various reasons, he ended up idling his time away in the Bahamas as manager of his own company… until a certain event disturbed his permanent vacation and entwined his fate with the Zaibatsu once again.","Leave it to me. I won't disappoint."
heihachi,Heihachi Mishima,Heihachi's,http://web.mit.edu/pmwh/www/enfreakment-images/clean/tk7_cs_heihachi.jpg,http://web.mit.edu/pmwh/www/enfreakment-images/clean/tk7_pr_heihachi.png,http://web.mit.edu/pmwh/www/enfreakment-images/clean/tk7_ig_heihachi.jpg,Japan,men,"The original leader of the Mishima Zaibatsu, and the fighter known as the 'King of the Iron Fist.' Heihachi continues to fight for control of the Mishima Zaibatsu against his son, Kazuya, and his grandson, Jin. After having recovered from the injuries he sustained in the suicide attack on him from the G Corporation's Jack units, Heihachi is back with an iron fist--and body to match.","You fool! I am invincible!",feng,Feng Wei,Feng's,http://web.mit.edu/pmwh/www/enfreakment-images/clean/tk7_cs_feng.jpg,http://web.mit.edu/pmwh/www/enfreakment-images/clean/tk7_pr_feng.png,http://web.mit.edu/pmwh/www/enfreakment-images/clean/tk7_ig_feng.jpg,China,men,"Feng Wei had always abided by what was written on the God Fist scroll: 'Defeat all other masters and conquer their styles; the perfect warrior transcends all to become the Dragon God.' Having fought masters of many different styles, Feng returned to his childhood training ground to continue his intense training regime. Then one day, an unexpected visitor appeared before Feng: a mysterious man who exuded strength. When the man made it clear that his desire was to fight, Feng had no reason to refuse. He accepted his opponent's challenge in silence, and prepared to battle.","Come on!",raven,Master Raven,Raven's,http://web.mit.edu/pmwh/www/enfreakment-images/clean/tk7_cs_raven.jpg,http://web.mit.edu/pmwh/www/enfreakment-images/clean/tk7_pr_raven.png,http://web.mit.edu/pmwh/www/enfreakment-images/clean/tk7_ig_raven.jpg,Unknown,women,"As an agent for the UN's intelligence bureau, Master Raven embarked on her latest top-secret mission: Infiltrate the King of Iron Fist Tournament and confront her assigned target. In the frozen area that was to be her battleground, Master Raven stood, arms folded, face to face with her subordinate's sworn enemy, who simply narrowed his eyes and took up a fighting pose.","It's just business. Don't take it personally.",eddy,Eddy Gordo,Eddy's,http://web.mit.edu/pmwh/www/enfreakment-images/clean/tk7_cs_eddy.jpg,http://web.mit.edu/pmwh/www/enfreakment-images/clean/tk7_pr_eddy.png,http://web.mit.edu/pmwh/www/enfreakment-images/clean/tk7_ig_eddy.jpg,Brazil,men,"Eddy Gordo went to G Corporation to exact revenge on Kazuya Mishima for murdering his father. After he'd taken out a crowd of guards, a young girl in a strange outfit stood before him, and struck a pose. 'You're not getting past me, old man! Teehee!' What did she mean by 'old man'? Confused and irritated by her appearance and disrespectful tone, but aware of the threat she posed, Eddy prepared to fight.","Don't think I'll go easy on you.",birdie,Birdie,Birdie's,http://web.mit.edu/pmwh/www/enfreakment-images/clean/sfv_cs_birdie.jpg,http://web.mit.edu/pmwh/www/enfreakment-images/clean/sfv_oa_birdie.jpg,http://web.mit.edu/pmwh/www/enfreakment-images/clean/sfv_ig_birdie.jpg,United Kingdom,men,"With a history that dates back to the original Street Fighter, Birdie’s appearance has changed dramatically over the years. He’s gone from being a muscular brute in the Alpha series to a beer bellied glutton in Street Fighter V.","Oi! It ain't too late to run home to Mum, now!"
akuma,Akuma,Akuma's,http://web.mit.edu/pmwh/www/enfreakment-images/clean/sfv_cs_akuma.jpg,http://web.mit.edu/pmwh/www/enfreakment-images/clean/sfv_oa_akuma.jpg,http://web.mit.edu/pmwh/www/enfreakment-images/clean/sfv_ig_akuma.jpg,Japan,men,"First appearing in Super Street Fighter II Turbo as a secret boss, Akuma remains one of the most powerful characters in the Street Fighter universe. Unlike Ryu and Ken, he embraces the killing intent of the Satsu no Hado.","Hmph. So it's you…",kazumi,Kazumi Mishima,Kazumi's,http://web.mit.edu/pmwh/www/enfreakment-images/clean/tk7_cs_kazumi.jpg,http://web.mit.edu/pmwh/www/enfreakment-images/clean/tk7_pr_kazumi.png,http://web.mit.edu/pmwh/www/enfreakment-images/clean/tk7_ig_kazumi.jpg,Japan,women,"Kazumi Mishima, wife of Heihachi Mishima, is well versed in Hachijyo Karate. She was childhood friends with her husband Heihachi and eventually they fell in love. Through their love they birthed a healthy young boy. Fast forward a few years later, Heihachi would become the head of a huge organization called the Mishima Zaibatsu, with plans to conquer the world. Kazumi loved Heihachi unconditionally, but at the same time he was beginning to feel dangerous. In this state, Heihachi threw the world into a war and Kazumi took it upon herself to stop him.","I will teach you the meaning of fear.",heihachi,Heihachi Mishima,Heihachi's,http://web.mit.edu/pmwh/www/enfreakment-images/clean/tk7_cs_heihachi.jpg,http://web.mit.edu/pmwh/www/enfreakment-images/clean/tk7_pr_heihachi.png,http://web.mit.edu/pmwh/www/enfreakment-images/clean/tk7_ig_heihachi.jpg,Japan,men,"The original leader of the Mishima Zaibatsu, and the fighter known as the 'King of the Iron Fist.' Heihachi continues to fight for control of the Mishima Zaibatsu against his son, Kazuya, and his grandson, Jin. After having recovered from the injuries he sustained in the suicide attack on him from the G Corporation's Jack units, Heihachi is back with an iron fist--and body to match.","You fool! I am invincible!",hwoarang,Hwoarang,Howarang's,http://web.mit.edu/pmwh/www/enfreakment-images/clean/tk7_cs_hwoarang.jpg,http://web.mit.edu/pmwh/www/enfreakment-images/clean/tk7_pr_hwoarang.png,http://web.mit.edu/pmwh/www/enfreakment-images/clean/tk7_ig_hwoarang.jpg,South Korea,men,"Hwoarang sees one man as his rival: Jin Kazama. Jin, CEO of the Mishima Zaibatsu, declared war against the world, and in the ensuing turmoil vanished suddenly, without a trace. Suspecting there is more to Jin's disappearance than meets the eye, Hwoarang vowed to track him down. With only a shred of reliable information at hand, he headed to the Middle East. After a series of dead leads, Hwoarang heard word that a demon had appeared in a town. Without a second thought, he got on his motorcycle and hammered down there. When he arrived, the place had been deserted, save for Jin Kazama in his devil form.","Come at me! I'll take you down.",jin,Jin Kazama,Jin's,http://web.mit.edu/pmwh/www/enfreakment-images/clean/tk7_cs_jin.jpg,http://web.mit.edu/pmwh/www/enfreakment-images/clean/tk7_pr_jin.png,http://web.mit.edu/pmwh/www/enfreakment-images/clean/tk7_ig_jin.jpg,Japan,men,"The leader of the Mishima Zaibatsu and the man who declared war on the world. Fighting the Devil inside him which gets stronger everyday, he yearns to be rid of it once and for all. When his battle is over at last, will he find hope… or despair?","Power is everything."
vega,Vega,Vega's,http://web.mit.edu/pmwh/www/enfreakment-images/clean/sfv_cs_vega.jpg,http://web.mit.edu/pmwh/www/enfreakment-images/clean/sfv_oa_vega.jpg,http://web.mit.edu/pmwh/www/enfreakment-images/clean/sfv_ig_vega.jpg,Spain,men,"As perhaps the most narcissistic man in the Street Fighter universe, Vega dresses like a matador but fights like a ninja. He cares only for beauty and despises anyone he considers ugly.","Let my beauty intoxicate you.",chun_li,Chun-Li,Chun-Li's,http://web.mit.edu/pmwh/www/enfreakment-images/clean/sfv_cs_chun_li.jpg,http://web.mit.edu/pmwh/www/enfreakment-images/clean/sfv_oa_chun_li.jpg,http://web.mit.edu/pmwh/www/enfreakment-images/clean/sfv_ig_chun_li.jpg,China,women,"As the first lady of Street Fighter, Chun-Li is widely regarded as the strongest woman in the world. She’s an agent for Interpol and is hell-bent on bringing both M. Bison and Shadaloo to justice.","I'll show you my Kung-Fu!",leo,Leo Kliesen,Leo's,http://web.mit.edu/pmwh/www/enfreakment-images/clean/tk7_cs_leo.jpg,http://web.mit.edu/pmwh/www/enfreakment-images/clean/tk7_pr_leo.png,http://web.mit.edu/pmwh/www/enfreakment-images/clean/tk7_ig_leo.jpg,Germany,men,"Leo entered the King of Iron Fist Tournament in the hope of uncovering more about his deceased mother, who had been a researcher for the Mishima Zaibatsu. When Leo learned that his battle arena was to be a Zaibatsu-owned dojo, he couldn't believe his luck. However, when he got there, the dojo was in ruin. The moonlight poured in through holes in the walls and roof, illuminating the floor with an eerie beauty. A short while later, a strange, floating silhouette appeared, and slowly glided toward Leo. The silhouette held a sword in its left hand that rotated at a mind-bending speed. What the hell was this thing? It looked like some kind of a flying squid or octopus! Was it a demon…? Then it finally dawned on Leo: This bizarre creature was his opponent. Cautiously, he prepared to fight.","Get ready!",balrog,Balrog,Balrog's,http://web.mit.edu/pmwh/www/enfreakment-images/clean/sfv_cs_balrog.jpg,http://web.mit.edu/pmwh/www/enfreakment-images/clean/sfv_oa_balrog.jpg,http://web.mit.edu/pmwh/www/enfreakment-images/clean/sfv_ig_balrog.jpg,United States of America,men,"As one of the four kings of Shadaloo, Balrog is a remorseless boxer who loves money, women, and bourbon. As long as Shadaloo continue to provide him with all three, he will fight for them.","There's no escape!",feng,Feng Wei,Feng's,http://web.mit.edu/pmwh/www/enfreakment-images/clean/tk7_cs_feng.jpg,http://web.mit.edu/pmwh/www/enfreakment-images/clean/tk7_pr_feng.png,http://web.mit.edu/pmwh/www/enfreakment-images/clean/tk7_ig_feng.jpg,China,men,"Feng Wei had always abided by what was written on the God Fist scroll: 'Defeat all other masters and conquer their styles; the perfect warrior transcends all to become the Dragon God.' Having fought masters of many different styles, Feng returned to his childhood training ground to continue his intense training regime. Then one day, an unexpected visitor appeared before Feng: a mysterious man who exuded strength. When the man made it clear that his desire was to fight, Feng had no reason to refuse. He accepted his opponent's challenge in silence, and prepared to battle.","Come on!"
bryan,Bryan Fury,Bryan's,http://web.mit.edu/pmwh/www/enfreakment-images/clean/tk7_cs_bryan.jpg,http://web.mit.edu/pmwh/www/enfreakment-images/clean/tk7_pr_bryan.png,http://web.mit.edu/pmwh/www/enfreakment-images/clean/tk7_ig_bryan.jpg,United States of America,men,"A savage fighter who uses a kickboxing fighting style. He's reported to have died twice and was somehow revived each time. He once belonged to an international police force, but Dr. Abel and Dr. Bosconovitch made him a replicant with a perpetual generator that keeps him alive.","Mwahahahaha! So, which one of you wants to die?",f_a_n_g,F.A.N.G,F.A.N.G.'s,http://web.mit.edu/pmwh/www/enfreakment-images/clean/sfv_cs_f_a_n_g.jpg,http://web.mit.edu/pmwh/www/enfreakment-images/clean/sfv_oa_f_a_n_g.jpg,http://web.mit.edu/pmwh/www/enfreakment-images/clean/sfv_ig_f_a_n_g.jpg,China,men,"Rounding off the quartet of new combatants in Street Fighter V is F.A.N.G. This assassin works for Shadaloo as M. Bison’s second in command.","Two minutes! I'll finish you in two minutes!",steve,Steve Fox,Steve's,http://web.mit.edu/pmwh/www/enfreakment-images/clean/tk7_cs_steve.jpg,http://web.mit.edu/pmwh/www/enfreakment-images/clean/tk7_pr_steve.png,http://web.mit.edu/pmwh/www/enfreakment-images/clean/tk7_ig_steve.jpg,United Kingdom,men,"Steve Fox has had plenty of run-ins with the Mishima Zaibatsu, but he never gave up his search for information about his past. Though his mother's identity remained a mystery, one name in particular began to crop up time and again: Nina Williams. Believing she knew something, Steve began investigating her whereabouts until he came up with a promising lead. The information led him to an imposing cathedral. As he considered how best to proceed, a figure appeared from inside, dressed in a tattered wedding gown. It was Nina, who seemed to be running away from something. Steve told her to stop, but she ignored him and fled. Determined not to let this opportunity escape him, he blocked her path.","Hey you… You wanna try me?",asuka,Asuka Kazama,Asuka's,http://web.mit.edu/pmwh/www/enfreakment-images/clean/tk7_cs_asuka.jpg,http://web.mit.edu/pmwh/www/enfreakment-images/clean/tk7_pr_asuka.png,http://web.mit.edu/pmwh/www/enfreakment-images/clean/tk7_ig_asuka.jpg,Japan,women,"Daughter of the Kazama Traditional Martial Arts School and known as 'Gang Mediator' in her hometown. Ever since she involved herself in a certain street fight, Lili has viewed her as a rival. She knows that Jin Kazama is her cousin and vows to take him down.","When you resort to fighting, everyone loses.",nash,Nash,Nash's,http://web.mit.edu/pmwh/www/enfreakment-images/clean/sfv_cs_nash.jpg,http://web.mit.edu/pmwh/www/enfreakment-images/clean/sfv_oa_nash.jpg,http://web.mit.edu/pmwh/www/enfreakment-images/clean/sfv_ig_nash.jpg,United States of America,men,"Written off as dead after the events of the Street Fighter Alpha series, Nash makes an unexpected return in Street Fighter V. His Frankenstein’s monster-esque appearance suggests he’s not the harbinger of justice we once knew…","I'll show no mercy!"
heihachi,Heihachi Mishima,Heihachi's,http://web.mit.edu/pmwh/www/enfreakment-images/clean/tk7_cs_heihachi.jpg,http://web.mit.edu/pmwh/www/enfreakment-images/clean/tk7_pr_heihachi.png,http://web.mit.edu/pmwh/www/enfreakment-images/clean/tk7_ig_heihachi.jpg,Japan,men,"The original leader of the Mishima Zaibatsu, and the fighter known as the 'King of the Iron Fist.' Heihachi continues to fight for control of the Mishima Zaibatsu against his son, Kazuya, and his grandson, Jin. After having recovered from the injuries he sustained in the suicide attack on him from the G Corporation's Jack units, Heihachi is back with an iron fist--and body to match.","You fool! I am invincible!",guile,Guile,Guile's,http://web.mit.edu/pmwh/www/enfreakment-images/clean/sfv_cs_guile.jpg,http://web.mit.edu/pmwh/www/enfreakment-images/clean/sfv_oa_guile.jpg,http://web.mit.edu/pmwh/www/enfreakment-images/clean/sfv_ig_guile.jpg,United States of America,men,"If you know anything about Street Fighter, chances are you've come across this all-American air force pilot and his flat-top haircut before. Guile returns in Street Fighter V seeking a comrade he previously believed dead.","No need for talk. Let's do this!",bryan,Bryan Fury,Bryan's,http://web.mit.edu/pmwh/www/enfreakment-images/clean/tk7_cs_bryan.jpg,http://web.mit.edu/pmwh/www/enfreakment-images/clean/tk7_pr_bryan.png,http://web.mit.edu/pmwh/www/enfreakment-images/clean/tk7_ig_bryan.jpg,United States of America,men,"A savage fighter who uses a kickboxing fighting style. He's reported to have died twice and was somehow revived each time. He once belonged to an international police force, but Dr. Abel and Dr. Bosconovitch made him a replicant with a perpetual generator that keeps him alive.","Mwahahahaha! So, which one of you wants to die?",chun_li,Chun-Li,Chun-Li's,http://web.mit.edu/pmwh/www/enfreakment-images/clean/sfv_cs_chun_li.jpg,http://web.mit.edu/pmwh/www/enfreakment-images/clean/sfv_oa_chun_li.jpg,http://web.mit.edu/pmwh/www/enfreakment-images/clean/sfv_ig_chun_li.jpg,China,women,"As the first lady of Street Fighter, Chun-Li is widely regarded as the strongest woman in the world. She’s an agent for Interpol and is hell-bent on bringing both M. Bison and Shadaloo to justice.","I'll show you my Kung-Fu!",ryu,Ryu,Ryu's,http://web.mit.edu/pmwh/www/enfreakment-images/clean/sfv_cs_ryu.jpg,http://web.mit.edu/pmwh/www/enfreakment-images/clean/sfv_oa_ryu.jpg,http://web.mit.edu/pmwh/www/enfreakment-images/clean/sfv_ig_ryu.jpg,Japan,men,"By travelling the world to improve his fighting ability, Ryu is the embodiment of the world warrior spirit. He's been the poster boy of the Street Fighter series since its inception.","This is the path of destiny!"
m_bison,M. Bison,M. Bison's,http://web.mit.edu/pmwh/www/enfreakment-images/clean/sfv_cs_m_bison.jpg,http://web.mit.edu/pmwh/www/enfreakment-images/clean/sfv_oa_m_bison.jpg,http://web.mit.edu/pmwh/www/enfreakment-images/clean/sfv_ig_m_bison.jpg,Unknown,men,"If there’s one character in the Street Fighter universe that can be described as pure evil, it has to be M. Bison. Brainwashing, human experimentation and remorseless murder, there’s nothing this dictator won’t do to fulfil his ambitions.","Bow down before my Psycho Power!",bob,Bob,Bob's,http://web.mit.edu/pmwh/www/enfreakment-images/clean/tk7_cs_bob.jpg,http://web.mit.edu/pmwh/www/enfreakment-images/clean/tk7_pr_bob.png,http://web.mit.edu/pmwh/www/enfreakment-images/clean/tk7_ig_bob.jpg,United States of America,men,"Once a fighter who had won the hearts of fans with his excellent sensibility and handsome good looks, he decided to transform himself completely by gaining weight to eliminate the perceived disadvantage he had in a fight due to his body type. His fans were disappointed, as on the outside it looked like he'd merely put on a few too many pounds, but Bob was definitely pleased with himself.","Speed and weight!",karin,Karin,Karin's,http://web.mit.edu/pmwh/www/enfreakment-images/clean/sfv_cs_karin.jpg,http://web.mit.edu/pmwh/www/enfreakment-images/clean/sfv_oa_karin.jpg,http://web.mit.edu/pmwh/www/enfreakment-images/clean/sfv_ig_karin.jpg,Japan,women,"As a top contender for the wealthiest fighter in the Street Fighter universe, Karin Kanzuki is understandably snobbish. She also counts the likes of Sakura, Ken and R. Mika among her rivals.","I'll show you the divide in our class!",eddy,Eddy Gordo,Eddy's,http://web.mit.edu/pmwh/www/enfreakment-images/clean/tk7_cs_eddy.jpg,http://web.mit.edu/pmwh/www/enfreakment-images/clean/tk7_pr_eddy.png,http://web.mit.edu/pmwh/www/enfreakment-images/clean/tk7_ig_eddy.jpg,Brazil,men,"Eddy Gordo went to G Corporation to exact revenge on Kazuya Mishima for murdering his father. After he'd taken out a crowd of guards, a young girl in a strange outfit stood before him, and struck a pose. 'You're not getting past me, old man! Teehee!' What did she mean by 'old man'? Confused and irritated by her appearance and disrespectful tone, but aware of the threat she posed, Eddy prepared to fight.","Don't think I'll go easy on you.",guile,Guile,Guile's,http://web.mit.edu/pmwh/www/enfreakment-images/clean/sfv_cs_guile.jpg,http://web.mit.edu/pmwh/www/enfreakment-images/clean/sfv_oa_guile.jpg,http://web.mit.edu/pmwh/www/enfreakment-images/clean/sfv_ig_guile.jpg,United States of America,men,"If you know anything about Street Fighter, chances are you've come across this all-American air force pilot and his flat-top haircut before. Guile returns in Street Fighter V seeking a comrade he previously believed dead.","No need for talk. Let's do this!"
