id1,name1,namepossessive1,imageA1,imageB1,imageC1,country1,gendergroup1,bio1,quote1,id2,name2,namepossessive2,imageA2,imageB2,imageC2,country2,gendergroup2,bio2,quote2,id3,name3,namepossessive3,imageA3,imageB3,imageC3,country3,gendergroup3,bio3,quote3,id4,name4,namepossessive4,imageA4,imageB4,imageC4,country4,gendergroup4,bio4,quote4,id5,name5,namepossessive5,imageA5,imageB5,imageC5,country5,gendergroup5,bio5,quote5
miguel,Miguel Caballero Rojo,Miguel's,http://web.mit.edu/pmwh/www/enfreakment-images/clean/tk7_cs_miguel.jpg,http://web.mit.edu/pmwh/www/enfreakment-images/clean/tk7_pr_miguel.png,http://web.mit.edu/pmwh/www/enfreakment-images/clean/tk7_ig_miguel.jpg,Spain,men,"After losing his sister in an airstrike ordered by the Mishima Zaibatsu under the direction of Jin Kazama, Miguel Caballero Rojo devoted his life to seeking revenge. However, when Jin suddenly vanishes without a trace, Miguel's life purpose disappears along with him. From that point forward, Miguel began to wander like a specter from battle-torn town to battle-torn town. One day, as he ambled through rows of dilapidated buildings, he stumbled across a strangely familiar hooded man. There in front of him was none other than his sworn enemy, Jin. Consumed by both euphoria and rage, Miguel becomes frenzied and goes in for the kill.","You look like you're ready to lose.",paul,Paul Phoenix,Paul's,http://web.mit.edu/pmwh/www/enfreakment-images/clean/tk7_cs_paul.jpg,http://web.mit.edu/pmwh/www/enfreakment-images/clean/tk7_pr_paul.png,http://web.mit.edu/pmwh/www/enfreakment-images/clean/tk7_ig_paul.jpg,United States of America,men,"When Paul Phoenix, the golden boy of the martial arts world, steps into the ring, the excitement in the crowd is palpable. But this time when his opponent's name rang over the arena's loudspeakers, he could only scratch his head in disbelief. It was Kuma… again! However, Kuma was nowhere to be seen. Word went round that the bear had dropped out of the tournament. The ring announcer informed the spectators of a last-minute change to the fight card. Relieved, Paul awaits the entrance of his long-anticipated human opponent…","I'll show you the power of the strongest in the universe… but not for free!",luckychloe,Lucky Chloe,Lucky Chloe's,http://web.mit.edu/pmwh/www/enfreakment-images/clean/tk7_cs_luckychloe.jpg,http://web.mit.edu/pmwh/www/enfreakment-images/clean/tk7_pr_luckychloe.png,http://web.mit.edu/pmwh/www/enfreakment-images/clean/tk7_ig_luckychloe.jpg,Unknown,women,"Lucky Chloe is a pop sensation, and the face of the G Corporation brand. When a mysterious man burst into G Corp and took out guard after guard with dance-like techniques, Lucky Chloe fearlessly walked right up to him and blocked his path. She threw the man one of her trademark smiles and issued him a challenge: Fight her, and if he loses he'll have to work as her backup dancer! Without caring if he'd accepted the conditions or not, she prepared for battle.","Are you ready?",urien,Urien,Urien's,http://web.mit.edu/pmwh/www/enfreakment-images/clean/sfv_cs_urien.jpg,http://web.mit.edu/pmwh/www/enfreakment-images/clean/sfv_oa_urien.jpg,http://web.mit.edu/pmwh/www/enfreakment-images/clean/sfv_ig_urien.jpg,Unknown,men,"First introduced in Street Fighter III: Second Impact, Urien is the vice president of the Illuminati. Unlike his benevolent brother, this self-serving tyrant is only interested in furthering his own interests.","Don't worry. I'll end you quickly.",law,Marshall Law,Law's,http://web.mit.edu/pmwh/www/enfreakment-images/clean/tk7_cs_law.jpg,http://web.mit.edu/pmwh/www/enfreakment-images/clean/tk7_pr_law.png,http://web.mit.edu/pmwh/www/enfreakment-images/clean/tk7_ig_law.jpg,United States of America,men,"Preoccupied with paying off his son's debts, Marshall Law didn't realize how many of his students had quit his dojo until it was almost too late. With a large sum still to repay, Law was running out of ideas. As a last resort, he decided to search for a capable fighter to run the dojo. He asked his friend Paul if he knew anyone, and in his usual manner, Paul said he himself would be the perfect candidate. However, thinking that the dojo would go bust in half a day if Paul took control, Law politely refused. Instead, he put the word out that if any strong fighters wanted to try out for the job, they should come and prove their skills in combat. Challenger after challenger appeared, but none of them were good enough for Law. Then, one day, Law heard a rumor that a martial artist living in rural China was set to be the next God Fist master. Seeing this as his best chance yet, Law set off for his ancestral homeland.","There's gotta be some way i can make some money off this!"
laura,Laura,Laura's,http://web.mit.edu/pmwh/www/enfreakment-images/clean/sfv_cs_laura.jpg,http://web.mit.edu/pmwh/www/enfreakment-images/clean/sfv_oa_laura.jpg,http://web.mit.edu/pmwh/www/enfreakment-images/clean/sfv_ig_laura.jpg,Brazil,women,"Laura is a brand-new Street Fighter character and a practitioner of Matsuda jiu-jitsu. If you recognize the name Matsuda, it's because Laura is the elder sister of Sean from Street Fighter III.","Boom! That's how to start a fight and finish it quickly!",dhalsim,Dhalsim,Dhalsim's,http://web.mit.edu/pmwh/www/enfreakment-images/clean/sfv_cs_dhalsim.jpg,http://web.mit.edu/pmwh/www/enfreakment-images/clean/sfv_oa_dhalsim.jpg,http://web.mit.edu/pmwh/www/enfreakment-images/clean/sfv_ig_dhalsim.jpg,India,men,"As one of the two most outlandish characters introduced in Street Fighter II, Dhalsim is a yoga master who can breathe fire and stretch his limbs at will. He’s always been one of the series’ more senior characters, as evidenced by his new white beard.","I am not very fond of conflict.",paul,Paul Phoenix,Paul's,http://web.mit.edu/pmwh/www/enfreakment-images/clean/tk7_cs_paul.jpg,http://web.mit.edu/pmwh/www/enfreakment-images/clean/tk7_pr_paul.png,http://web.mit.edu/pmwh/www/enfreakment-images/clean/tk7_ig_paul.jpg,United States of America,men,"When Paul Phoenix, the golden boy of the martial arts world, steps into the ring, the excitement in the crowd is palpable. But this time when his opponent's name rang over the arena's loudspeakers, he could only scratch his head in disbelief. It was Kuma… again! However, Kuma was nowhere to be seen. Word went round that the bear had dropped out of the tournament. The ring announcer informed the spectators of a last-minute change to the fight card. Relieved, Paul awaits the entrance of his long-anticipated human opponent…","I'll show you the power of the strongest in the universe… but not for free!",vega,Vega,Vega's,http://web.mit.edu/pmwh/www/enfreakment-images/clean/sfv_cs_vega.jpg,http://web.mit.edu/pmwh/www/enfreakment-images/clean/sfv_oa_vega.jpg,http://web.mit.edu/pmwh/www/enfreakment-images/clean/sfv_ig_vega.jpg,Spain,men,"As perhaps the most narcissistic man in the Street Fighter universe, Vega dresses like a matador but fights like a ninja. He cares only for beauty and despises anyone he considers ugly.","Let my beauty intoxicate you.",eddy,Eddy Gordo,Eddy's,http://web.mit.edu/pmwh/www/enfreakment-images/clean/tk7_cs_eddy.jpg,http://web.mit.edu/pmwh/www/enfreakment-images/clean/tk7_pr_eddy.png,http://web.mit.edu/pmwh/www/enfreakment-images/clean/tk7_ig_eddy.jpg,Brazil,men,"Eddy Gordo went to G Corporation to exact revenge on Kazuya Mishima for murdering his father. After he'd taken out a crowd of guards, a young girl in a strange outfit stood before him, and struck a pose. 'You're not getting past me, old man! Teehee!' What did she mean by 'old man'? Confused and irritated by her appearance and disrespectful tone, but aware of the threat she posed, Eddy prepared to fight.","Don't think I'll go easy on you."
xiaoyu,Ling Xiaoyu,Xiaoyu's,http://web.mit.edu/pmwh/www/enfreakment-images/clean/tk7_cs_xiaoyu.jpg,http://web.mit.edu/pmwh/www/enfreakment-images/clean/tk7_pr_xiaoyu.png,http://web.mit.edu/pmwh/www/enfreakment-images/clean/tk7_ig_xiaoyu.jpg,China,women,"Ling Xiaoyu infiltrated the Mishima Zaibatsu building in search of information relating to Jin Kazama's disappearance. Creeping deeper into the enemy territory under the guards' noses, she eventually hears Heihachi Mishima's voice coming from a room; he was giving orders about locating Jin. Just as Xiaoyu was about to sneak into the room, a man dressed all in white emerged and pushed her back. 'Take me to Jin!' Xiaoyu demanded, unflinching. The man stood there for a moment, before ordering Xiaoyu to follow him. He led her to the roof, then silently turned toward her, and readied himself to fight. Xiaoyu took up her fighting stance, and said, 'So that's how it is... If you think I'm just some little girl, you're sadly mistaken.'","I'm going to stop Jin!",kazumi,Kazumi Mishima,Kazumi's,http://web.mit.edu/pmwh/www/enfreakment-images/clean/tk7_cs_kazumi.jpg,http://web.mit.edu/pmwh/www/enfreakment-images/clean/tk7_pr_kazumi.png,http://web.mit.edu/pmwh/www/enfreakment-images/clean/tk7_ig_kazumi.jpg,Japan,women,"Kazumi Mishima, wife of Heihachi Mishima, is well versed in Hachijyo Karate. She was childhood friends with her husband Heihachi and eventually they fell in love. Through their love they birthed a healthy young boy. Fast forward a few years later, Heihachi would become the head of a huge organization called the Mishima Zaibatsu, with plans to conquer the world. Kazumi loved Heihachi unconditionally, but at the same time he was beginning to feel dangerous. In this state, Heihachi threw the world into a war and Kazumi took it upon herself to stop him.","I will teach you the meaning of fear.",balrog,Balrog,Balrog's,http://web.mit.edu/pmwh/www/enfreakment-images/clean/sfv_cs_balrog.jpg,http://web.mit.edu/pmwh/www/enfreakment-images/clean/sfv_oa_balrog.jpg,http://web.mit.edu/pmwh/www/enfreakment-images/clean/sfv_ig_balrog.jpg,United States of America,men,"As one of the four kings of Shadaloo, Balrog is a remorseless boxer who loves money, women, and bourbon. As long as Shadaloo continue to provide him with all three, he will fight for them.","There's no escape!",necalli,Necalli,Necalli's,http://web.mit.edu/pmwh/www/enfreakment-images/clean/sfv_cs_necalli.jpg,http://web.mit.edu/pmwh/www/enfreakment-images/clean/sfv_oa_necalli.jpg,http://web.mit.edu/pmwh/www/enfreakment-images/clean/sfv_ig_necalli.jpg,Unknown,men,"As one of the four new characters introduced in Street Fighter V, much of Necalli’s past is shrouded in mystery. His fighting style is best described as animalistic, due to his feral slashes and stomps.","Devour-our-our…",steve,Steve Fox,Steve's,http://web.mit.edu/pmwh/www/enfreakment-images/clean/tk7_cs_steve.jpg,http://web.mit.edu/pmwh/www/enfreakment-images/clean/tk7_pr_steve.png,http://web.mit.edu/pmwh/www/enfreakment-images/clean/tk7_ig_steve.jpg,United Kingdom,men,"Steve Fox has had plenty of run-ins with the Mishima Zaibatsu, but he never gave up his search for information about his past. Though his mother's identity remained a mystery, one name in particular began to crop up time and again: Nina Williams. Believing she knew something, Steve began investigating her whereabouts until he came up with a promising lead. The information led him to an imposing cathedral. As he considered how best to proceed, a figure appeared from inside, dressed in a tattered wedding gown. It was Nina, who seemed to be running away from something. Steve told her to stop, but she ignored him and fled. Determined not to let this opportunity escape him, he blocked her path.","Hey you… You wanna try me?"
luckychloe,Lucky Chloe,Lucky Chloe's,http://web.mit.edu/pmwh/www/enfreakment-images/clean/tk7_cs_luckychloe.jpg,http://web.mit.edu/pmwh/www/enfreakment-images/clean/tk7_pr_luckychloe.png,http://web.mit.edu/pmwh/www/enfreakment-images/clean/tk7_ig_luckychloe.jpg,Unknown,women,"Lucky Chloe is a pop sensation, and the face of the G Corporation brand. When a mysterious man burst into G Corp and took out guard after guard with dance-like techniques, Lucky Chloe fearlessly walked right up to him and blocked his path. She threw the man one of her trademark smiles and issued him a challenge: Fight her, and if he loses he'll have to work as her backup dancer! Without caring if he'd accepted the conditions or not, she prepared for battle.","Are you ready?",steve,Steve Fox,Steve's,http://web.mit.edu/pmwh/www/enfreakment-images/clean/tk7_cs_steve.jpg,http://web.mit.edu/pmwh/www/enfreakment-images/clean/tk7_pr_steve.png,http://web.mit.edu/pmwh/www/enfreakment-images/clean/tk7_ig_steve.jpg,United Kingdom,men,"Steve Fox has had plenty of run-ins with the Mishima Zaibatsu, but he never gave up his search for information about his past. Though his mother's identity remained a mystery, one name in particular began to crop up time and again: Nina Williams. Believing she knew something, Steve began investigating her whereabouts until he came up with a promising lead. The information led him to an imposing cathedral. As he considered how best to proceed, a figure appeared from inside, dressed in a tattered wedding gown. It was Nina, who seemed to be running away from something. Steve told her to stop, but she ignored him and fled. Determined not to let this opportunity escape him, he blocked her path.","Hey you… You wanna try me?",karin,Karin,Karin's,http://web.mit.edu/pmwh/www/enfreakment-images/clean/sfv_cs_karin.jpg,http://web.mit.edu/pmwh/www/enfreakment-images/clean/sfv_oa_karin.jpg,http://web.mit.edu/pmwh/www/enfreakment-images/clean/sfv_ig_karin.jpg,Japan,women,"As a top contender for the wealthiest fighter in the Street Fighter universe, Karin Kanzuki is understandably snobbish. She also counts the likes of Sakura, Ken and R. Mika among her rivals.","I'll show you the divide in our class!",r_mika,R. Mika,R. Mika's,http://web.mit.edu/pmwh/www/enfreakment-images/clean/sfv_cs_r_mika.jpg,http://web.mit.edu/pmwh/www/enfreakment-images/clean/sfv_oa_r_mika.jpg,http://web.mit.edu/pmwh/www/enfreakment-images/clean/sfv_ig_r_mika.jpg,Japan,women,"First appearing in Street Fighter Alpha 3, Rainbow Mika is a pro wrestler who idolises Zangief. Many of her special moves are exaggerated versions of real-life wrestling techniques.","I'll kick your ass! All right! Let's begiiiin!!!",ibuki,Ibuki,Ibuki's,http://web.mit.edu/pmwh/www/enfreakment-images/clean/sfv_cs_ibuki.jpg,http://web.mit.edu/pmwh/www/enfreakment-images/clean/sfv_oa_ibuki.jpg,http://web.mit.edu/pmwh/www/enfreakment-images/clean/sfv_ig_ibuki.jpg,Japan,women,"First appearing in Street Fighter III: New Generation, Ibuki is a Japanese kunoichi and highschool student. She finds her ninja training tedious, preferring to slack off with her pet racoon dog, Don-chan.","I will finish this in no time!"
dhalsim,Dhalsim,Dhalsim's,http://web.mit.edu/pmwh/www/enfreakment-images/clean/sfv_cs_dhalsim.jpg,http://web.mit.edu/pmwh/www/enfreakment-images/clean/sfv_oa_dhalsim.jpg,http://web.mit.edu/pmwh/www/enfreakment-images/clean/sfv_ig_dhalsim.jpg,India,men,"As one of the two most outlandish characters introduced in Street Fighter II, Dhalsim is a yoga master who can breathe fire and stretch his limbs at will. He’s always been one of the series’ more senior characters, as evidenced by his new white beard.","I am not very fond of conflict.",birdie,Birdie,Birdie's,http://web.mit.edu/pmwh/www/enfreakment-images/clean/sfv_cs_birdie.jpg,http://web.mit.edu/pmwh/www/enfreakment-images/clean/sfv_oa_birdie.jpg,http://web.mit.edu/pmwh/www/enfreakment-images/clean/sfv_ig_birdie.jpg,United Kingdom,men,"With a history that dates back to the original Street Fighter, Birdie’s appearance has changed dramatically over the years. He’s gone from being a muscular brute in the Alpha series to a beer bellied glutton in Street Fighter V.","Oi! It ain't too late to run home to Mum, now!",urien,Urien,Urien's,http://web.mit.edu/pmwh/www/enfreakment-images/clean/sfv_cs_urien.jpg,http://web.mit.edu/pmwh/www/enfreakment-images/clean/sfv_oa_urien.jpg,http://web.mit.edu/pmwh/www/enfreakment-images/clean/sfv_ig_urien.jpg,Unknown,men,"First introduced in Street Fighter III: Second Impact, Urien is the vice president of the Illuminati. Unlike his benevolent brother, this self-serving tyrant is only interested in furthering his own interests.","Don't worry. I'll end you quickly.",jin,Jin Kazama,Jin's,http://web.mit.edu/pmwh/www/enfreakment-images/clean/tk7_cs_jin.jpg,http://web.mit.edu/pmwh/www/enfreakment-images/clean/tk7_pr_jin.png,http://web.mit.edu/pmwh/www/enfreakment-images/clean/tk7_ig_jin.jpg,Japan,men,"The leader of the Mishima Zaibatsu and the man who declared war on the world. Fighting the Devil inside him which gets stronger everyday, he yearns to be rid of it once and for all. When his battle is over at last, will he find hope… or despair?","Power is everything.",juri,Juri,Juri's,http://web.mit.edu/pmwh/www/enfreakment-images/clean/sfv_cs_juri.jpg,http://web.mit.edu/pmwh/www/enfreakment-images/clean/sfv_oa_juri.jpg,http://web.mit.edu/pmwh/www/enfreakment-images/clean/sfv_ig_juri.jpg,South Korea,women,"Introduced in Super Street Fighter IV, Juri is a sadistic Tae Kwon Do expert with a cybernetic eye. She loathes Shadaloo for killing her parents, and wants nothing more than to see M. Bison dead.","Well then, where do you want me to break you first?"
king,King,King's,http://web.mit.edu/pmwh/www/enfreakment-images/clean/tk7_cs_king.jpg,http://web.mit.edu/pmwh/www/enfreakment-images/clean/tk7_pr_king.png,http://web.mit.edu/pmwh/www/enfreakment-images/clean/tk7_ig_king.jpg,Mexico,men,"King is not only a masked professional wrestler, but also the proud owner of an orphanage. Recently, King's sworn friend and comrade, Craig Marduk, as well as the man King called his master, both engaged in a bloody fight which left them with critical injuries. King desperately wanted to come to his friends' rescue, but knew that their operations wouldn't come cheap. At the same time, King's orphanage was in constant danger owing to the war that raged between G Corporation and the Mishima Zaibatsu. Finding himself caught between a rock and a hard place, King entered the King of Iron Fist Tournament with his eyes set firmly on the cash prize.","Let's do this.",necalli,Necalli,Necalli's,http://web.mit.edu/pmwh/www/enfreakment-images/clean/sfv_cs_necalli.jpg,http://web.mit.edu/pmwh/www/enfreakment-images/clean/sfv_oa_necalli.jpg,http://web.mit.edu/pmwh/www/enfreakment-images/clean/sfv_ig_necalli.jpg,Unknown,men,"As one of the four new characters introduced in Street Fighter V, much of Necalli’s past is shrouded in mystery. His fighting style is best described as animalistic, due to his feral slashes and stomps.","Devour-our-our…",nina,Nina Williams,Nina's,http://web.mit.edu/pmwh/www/enfreakment-images/clean/tk7_cs_nina.jpg,http://web.mit.edu/pmwh/www/enfreakment-images/clean/tk7_pr_nina.png,http://web.mit.edu/pmwh/www/enfreakment-images/clean/tk7_ig_nina.jpg,Ireland,women,"After failing to apprehend Jin Kazama, Nina Williams decided it was time for her and the Mishima Zaibatsu to go their separate ways. On her first private assassination job, she was tasked with infiltrating a mafia wedding… posing as the bride! During the ceremony, a firefight broke out where Nina took out all her targets. However, the commotion had attracted the Tekken Force, who had been dispatched to suppress the violence, and they gave chase. With the Tekken Force in hot pursuit, Nina made her escape. That's when she bumped into a man she found vaguely familiar. The man wouldn't leave her alone. He seemed to have something he wanted to say to her… Nina decided that a confrontation was her best chance of escape.","You've got a date with death.",zeku,Zeku,Zeku's,http://web.mit.edu/pmwh/www/enfreakment-images/clean/sfv_cs_zeku.jpg,http://web.mit.edu/pmwh/www/enfreakment-images/clean/sfv_oa_zeku.jpg,http://web.mit.edu/pmwh/www/enfreakment-images/clean/sfv_ig_zeku.jpg,Japan,men,"First appearing in Guy's ending for Street Fighter Alpha II, Zeku is the 38th successor of Bushinryu. Using a special ninja technique, he can reverse his aging to become young again.","Lets party! If you think you can keep up.",heihachi,Heihachi Mishima,Heihachi's,http://web.mit.edu/pmwh/www/enfreakment-images/clean/tk7_cs_heihachi.jpg,http://web.mit.edu/pmwh/www/enfreakment-images/clean/tk7_pr_heihachi.png,http://web.mit.edu/pmwh/www/enfreakment-images/clean/tk7_ig_heihachi.jpg,Japan,men,"The original leader of the Mishima Zaibatsu, and the fighter known as the 'King of the Iron Fist.' Heihachi continues to fight for control of the Mishima Zaibatsu against his son, Kazuya, and his grandson, Jin. After having recovered from the injuries he sustained in the suicide attack on him from the G Corporation's Jack units, Heihachi is back with an iron fist--and body to match.","You fool! I am invincible!"
laura,Laura,Laura's,http://web.mit.edu/pmwh/www/enfreakment-images/clean/sfv_cs_laura.jpg,http://web.mit.edu/pmwh/www/enfreakment-images/clean/sfv_oa_laura.jpg,http://web.mit.edu/pmwh/www/enfreakment-images/clean/sfv_ig_laura.jpg,Brazil,women,"Laura is a brand-new Street Fighter character and a practitioner of Matsuda jiu-jitsu. If you recognize the name Matsuda, it's because Laura is the elder sister of Sean from Street Fighter III.","Boom! That's how to start a fight and finish it quickly!",shaheen,Shaheen,Shaheen's,http://web.mit.edu/pmwh/www/enfreakment-images/clean/tk7_cs_shaheen.jpg,http://web.mit.edu/pmwh/www/enfreakment-images/clean/tk7_pr_shaheen.png,http://web.mit.edu/pmwh/www/enfreakment-images/clean/tk7_ig_shaheen.jpg,Saudi Arabia,men,"Shaheen works for a private military firm specializing in the provision of security services. During his time in the army, he earned a reputation as an expert in one-on-one combat. One day, his friend and owner of a company involved in the oil industry died suddenly under mysterious circumstances. In the postmortem the death was listed as accidental, but Shaheen suspected foul play when his friend's company was suddenly bought by G Corporation and the management, all family members, resigned. He began to investigate the matter, and a relative of a close friend confided in him that a demonic man was pulling the strings at G Corp: Kazuya Mishima. Shaheen struggled to believe a real demon could exist, but his investigations revealed that Kazuya could be worse than any of hell's creations. Shaheen was torn: Should he take revenge for his friend's death by destroying that demon, or not? Wracked with doubt, he embarked on a solo mission to infiltrate G Corp.","I do not wish to hurt you, but I will fight if I must.",r_mika,R. Mika,R. Mika's,http://web.mit.edu/pmwh/www/enfreakment-images/clean/sfv_cs_r_mika.jpg,http://web.mit.edu/pmwh/www/enfreakment-images/clean/sfv_oa_r_mika.jpg,http://web.mit.edu/pmwh/www/enfreakment-images/clean/sfv_ig_r_mika.jpg,Japan,women,"First appearing in Street Fighter Alpha 3, Rainbow Mika is a pro wrestler who idolises Zangief. Many of her special moves are exaggerated versions of real-life wrestling techniques.","I'll kick your ass! All right! Let's begiiiin!!!",hwoarang,Hwoarang,Howarang's,http://web.mit.edu/pmwh/www/enfreakment-images/clean/tk7_cs_hwoarang.jpg,http://web.mit.edu/pmwh/www/enfreakment-images/clean/tk7_pr_hwoarang.png,http://web.mit.edu/pmwh/www/enfreakment-images/clean/tk7_ig_hwoarang.jpg,South Korea,men,"Hwoarang sees one man as his rival: Jin Kazama. Jin, CEO of the Mishima Zaibatsu, declared war against the world, and in the ensuing turmoil vanished suddenly, without a trace. Suspecting there is more to Jin's disappearance than meets the eye, Hwoarang vowed to track him down. With only a shred of reliable information at hand, he headed to the Middle East. After a series of dead leads, Hwoarang heard word that a demon had appeared in a town. Without a second thought, he got on his motorcycle and hammered down there. When he arrived, the place had been deserted, save for Jin Kazama in his devil form.","Come at me! I'll take you down.",lars,Lars Alexandersson,Lars's,http://web.mit.edu/pmwh/www/enfreakment-images/clean/tk7_cs_lars.jpg,http://web.mit.edu/pmwh/www/enfreakment-images/clean/tk7_pr_lars.png,http://web.mit.edu/pmwh/www/enfreakment-images/clean/tk7_ig_lars.jpg,Sweden,men,"A former officer of the Mishima Zaibatsu's special military unit, the Tekken Force, Lars enacted a coup d'état and rebelled against his former employer. Lars continues to fight despite the loss of his fallen comrades, and his bloody rebellion is nowhere near finished.","Think you can stop me?"
