id1,name1,namepossessive1,imageA1,imageB1,imageC1,country1,gendergroup1,bio1,quote1,id2,name2,namepossessive2,imageA2,imageB2,imageC2,country2,gendergroup2,bio2,quote2,id3,name3,namepossessive3,imageA3,imageB3,imageC3,country3,gendergroup3,bio3,quote3,id4,name4,namepossessive4,imageA4,imageB4,imageC4,country4,gendergroup4,bio4,quote4,id5,name5,namepossessive5,imageA5,imageB5,imageC5,country5,gendergroup5,bio5,quote5
chun_li,Chun-Li,Chun-Li's,http://web.mit.edu/pmwh/www/enfreakment-images/clean/sfv_cs_chun_li.jpg,http://web.mit.edu/pmwh/www/enfreakment-images/clean/sfv_oa_chun_li.jpg,http://web.mit.edu/pmwh/www/enfreakment-images/clean/sfv_ig_chun_li.jpg,China,women,"As the first lady of Street Fighter, Chun-Li is widely regarded as the strongest woman in the world. She’s an agent for Interpol and is hell-bent on bringing both M. Bison and Shadaloo to justice.","I'll show you my Kung-Fu!",nina,Nina Williams,Nina's,http://web.mit.edu/pmwh/www/enfreakment-images/clean/tk7_cs_nina.jpg,http://web.mit.edu/pmwh/www/enfreakment-images/clean/tk7_pr_nina.png,http://web.mit.edu/pmwh/www/enfreakment-images/clean/tk7_ig_nina.jpg,Ireland,women,"After failing to apprehend Jin Kazama, Nina Williams decided it was time for her and the Mishima Zaibatsu to go their separate ways. On her first private assassination job, she was tasked with infiltrating a mafia wedding… posing as the bride! During the ceremony, a firefight broke out where Nina took out all her targets. However, the commotion had attracted the Tekken Force, who had been dispatched to suppress the violence, and they gave chase. With the Tekken Force in hot pursuit, Nina made her escape. That's when she bumped into a man she found vaguely familiar. The man wouldn't leave her alone. He seemed to have something he wanted to say to her… Nina decided that a confrontation was her best chance of escape.","You've got a date with death.",lars,Lars Alexandersson,Lars's,http://web.mit.edu/pmwh/www/enfreakment-images/clean/tk7_cs_lars.jpg,http://web.mit.edu/pmwh/www/enfreakment-images/clean/tk7_pr_lars.png,http://web.mit.edu/pmwh/www/enfreakment-images/clean/tk7_ig_lars.jpg,Sweden,men,"A former officer of the Mishima Zaibatsu's special military unit, the Tekken Force, Lars enacted a coup d'état and rebelled against his former employer. Lars continues to fight despite the loss of his fallen comrades, and his bloody rebellion is nowhere near finished.","Think you can stop me?",cammy,Cammy,Cammy's,http://web.mit.edu/pmwh/www/enfreakment-images/clean/sfv_cs_cammy.jpg,http://web.mit.edu/pmwh/www/enfreakment-images/clean/sfv_oa_cammy.jpg,http://web.mit.edu/pmwh/www/enfreakment-images/clean/sfv_ig_cammy.jpg,United Kingdom,women,"Once a mindless doll under the control of Shadaloo, Cammy broke free of her brainwashing and joined a Special Forces unit called Delta Red. Her former codename was Killer Bee. She also has a fondness for cats.","I fight for those I want to protect!",steve,Steve Fox,Steve's,http://web.mit.edu/pmwh/www/enfreakment-images/clean/tk7_cs_steve.jpg,http://web.mit.edu/pmwh/www/enfreakment-images/clean/tk7_pr_steve.png,http://web.mit.edu/pmwh/www/enfreakment-images/clean/tk7_ig_steve.jpg,United Kingdom,men,"Steve Fox has had plenty of run-ins with the Mishima Zaibatsu, but he never gave up his search for information about his past. Though his mother's identity remained a mystery, one name in particular began to crop up time and again: Nina Williams. Believing she knew something, Steve began investigating her whereabouts until he came up with a promising lead. The information led him to an imposing cathedral. As he considered how best to proceed, a figure appeared from inside, dressed in a tattered wedding gown. It was Nina, who seemed to be running away from something. Steve told her to stop, but she ignored him and fled. Determined not to let this opportunity escape him, he blocked her path.","Hey you… You wanna try me?"
cammy,Cammy,Cammy's,http://web.mit.edu/pmwh/www/enfreakment-images/clean/sfv_cs_cammy.jpg,http://web.mit.edu/pmwh/www/enfreakment-images/clean/sfv_oa_cammy.jpg,http://web.mit.edu/pmwh/www/enfreakment-images/clean/sfv_ig_cammy.jpg,United Kingdom,women,"Once a mindless doll under the control of Shadaloo, Cammy broke free of her brainwashing and joined a Special Forces unit called Delta Red. Her former codename was Killer Bee. She also has a fondness for cats.","I fight for those I want to protect!",dragunov,Sergei Dragunov,Sergei's,http://web.mit.edu/pmwh/www/enfreakment-images/clean/tk7_cs_dragunov.jpg,http://web.mit.edu/pmwh/www/enfreakment-images/clean/tk7_pr_dragunov.png,http://web.mit.edu/pmwh/www/enfreakment-images/clean/tk7_ig_dragunov.jpg,Russia,men,"Sergei Dragunov entered the King of Iron Fist Tournament on army orders. At the designated arena of his first match, a woman appeared before him. There was something strangely familiar about her… It didn't take Dragunov long to figure out who she was, and he wasted no time in readying himself for combat.","…",r_mika,R. Mika,R. Mika's,http://web.mit.edu/pmwh/www/enfreakment-images/clean/sfv_cs_r_mika.jpg,http://web.mit.edu/pmwh/www/enfreakment-images/clean/sfv_oa_r_mika.jpg,http://web.mit.edu/pmwh/www/enfreakment-images/clean/sfv_ig_r_mika.jpg,Japan,women,"First appearing in Street Fighter Alpha 3, Rainbow Mika is a pro wrestler who idolises Zangief. Many of her special moves are exaggerated versions of real-life wrestling techniques.","I'll kick your ass! All right! Let's begiiiin!!!",miguel,Miguel Caballero Rojo,Miguel's,http://web.mit.edu/pmwh/www/enfreakment-images/clean/tk7_cs_miguel.jpg,http://web.mit.edu/pmwh/www/enfreakment-images/clean/tk7_pr_miguel.png,http://web.mit.edu/pmwh/www/enfreakment-images/clean/tk7_ig_miguel.jpg,Spain,men,"After losing his sister in an airstrike ordered by the Mishima Zaibatsu under the direction of Jin Kazama, Miguel Caballero Rojo devoted his life to seeking revenge. However, when Jin suddenly vanishes without a trace, Miguel's life purpose disappears along with him. From that point forward, Miguel began to wander like a specter from battle-torn town to battle-torn town. One day, as he ambled through rows of dilapidated buildings, he stumbled across a strangely familiar hooded man. There in front of him was none other than his sworn enemy, Jin. Consumed by both euphoria and rage, Miguel becomes frenzied and goes in for the kill.","You look like you're ready to lose.",xiaoyu,Ling Xiaoyu,Xiaoyu's,http://web.mit.edu/pmwh/www/enfreakment-images/clean/tk7_cs_xiaoyu.jpg,http://web.mit.edu/pmwh/www/enfreakment-images/clean/tk7_pr_xiaoyu.png,http://web.mit.edu/pmwh/www/enfreakment-images/clean/tk7_ig_xiaoyu.jpg,China,women,"Ling Xiaoyu infiltrated the Mishima Zaibatsu building in search of information relating to Jin Kazama's disappearance. Creeping deeper into the enemy territory under the guards' noses, she eventually hears Heihachi Mishima's voice coming from a room; he was giving orders about locating Jin. Just as Xiaoyu was about to sneak into the room, a man dressed all in white emerged and pushed her back. 'Take me to Jin!' Xiaoyu demanded, unflinching. The man stood there for a moment, before ordering Xiaoyu to follow him. He led her to the roof, then silently turned toward her, and readied himself to fight. Xiaoyu took up her fighting stance, and said, 'So that's how it is... If you think I'm just some little girl, you're sadly mistaken.'","I'm going to stop Jin!"
josie,Josie Rizal,Josie's,http://web.mit.edu/pmwh/www/enfreakment-images/clean/tk7_cs_josie.jpg,http://web.mit.edu/pmwh/www/enfreakment-images/clean/tk7_pr_josie.png,http://web.mit.edu/pmwh/www/enfreakment-images/clean/tk7_ig_josie.jpg,Philippines,women,"Josie Rizal tried her best to support her family by balancing two jobs. One as a model, and one as a professional kickboxer. One day, while she was out running on her usual training course along the mountain roads, she was suddenly confronted by an enormous, hairy creature! Josie screamed, and then fled half in tears, but the creature remained hot on her heels. Realizing she had little chance of escape, Josie abruptly came to a halt, then turned trembling, to face her feral foe…","I got this!",lili,Emilie 'Lili' De Rochefort,Lili's,http://web.mit.edu/pmwh/www/enfreakment-images/clean/tk7_cs_lili.jpg,http://web.mit.edu/pmwh/www/enfreakment-images/clean/tk7_pr_lili.png,http://web.mit.edu/pmwh/www/enfreakment-images/clean/tk7_ig_lili.jpg,Monaco,women,"Lili entered the King of Iron Fist Tournament again without telling her father this time either. There she was anyway, smiling as the rapturous crowd looked on and her opponent entered the arena. Lili was set to fight Asuka Kazama, someone she had personally considered her greatest rival for many years. If Lili saw the look of annoyance on Asuka's face, it didn't show; she just walked elegantly to the center of the ring like she owned it, all the while thanking Lady Luck for the opportunity to fight her rival.","You surely don't believe… you can beat me?",chun_li,Chun-Li,Chun-Li's,http://web.mit.edu/pmwh/www/enfreakment-images/clean/sfv_cs_chun_li.jpg,http://web.mit.edu/pmwh/www/enfreakment-images/clean/sfv_oa_chun_li.jpg,http://web.mit.edu/pmwh/www/enfreakment-images/clean/sfv_ig_chun_li.jpg,China,women,"As the first lady of Street Fighter, Chun-Li is widely regarded as the strongest woman in the world. She’s an agent for Interpol and is hell-bent on bringing both M. Bison and Shadaloo to justice.","I'll show you my Kung-Fu!",eddy,Eddy Gordo,Eddy's,http://web.mit.edu/pmwh/www/enfreakment-images/clean/tk7_cs_eddy.jpg,http://web.mit.edu/pmwh/www/enfreakment-images/clean/tk7_pr_eddy.png,http://web.mit.edu/pmwh/www/enfreakment-images/clean/tk7_ig_eddy.jpg,Brazil,men,"Eddy Gordo went to G Corporation to exact revenge on Kazuya Mishima for murdering his father. After he'd taken out a crowd of guards, a young girl in a strange outfit stood before him, and struck a pose. 'You're not getting past me, old man! Teehee!' What did she mean by 'old man'? Confused and irritated by her appearance and disrespectful tone, but aware of the threat she posed, Eddy prepared to fight.","Don't think I'll go easy on you.",kazumi,Kazumi Mishima,Kazumi's,http://web.mit.edu/pmwh/www/enfreakment-images/clean/tk7_cs_kazumi.jpg,http://web.mit.edu/pmwh/www/enfreakment-images/clean/tk7_pr_kazumi.png,http://web.mit.edu/pmwh/www/enfreakment-images/clean/tk7_ig_kazumi.jpg,Japan,women,"Kazumi Mishima, wife of Heihachi Mishima, is well versed in Hachijyo Karate. She was childhood friends with her husband Heihachi and eventually they fell in love. Through their love they birthed a healthy young boy. Fast forward a few years later, Heihachi would become the head of a huge organization called the Mishima Zaibatsu, with plans to conquer the world. Kazumi loved Heihachi unconditionally, but at the same time he was beginning to feel dangerous. In this state, Heihachi threw the world into a war and Kazumi took it upon herself to stop him.","I will teach you the meaning of fear."
josie,Josie Rizal,Josie's,http://web.mit.edu/pmwh/www/enfreakment-images/clean/tk7_cs_josie.jpg,http://web.mit.edu/pmwh/www/enfreakment-images/clean/tk7_pr_josie.png,http://web.mit.edu/pmwh/www/enfreakment-images/clean/tk7_ig_josie.jpg,Philippines,women,"Josie Rizal tried her best to support her family by balancing two jobs. One as a model, and one as a professional kickboxer. One day, while she was out running on her usual training course along the mountain roads, she was suddenly confronted by an enormous, hairy creature! Josie screamed, and then fled half in tears, but the creature remained hot on her heels. Realizing she had little chance of escape, Josie abruptly came to a halt, then turned trembling, to face her feral foe…","I got this!",raven,Master Raven,Raven's,http://web.mit.edu/pmwh/www/enfreakment-images/clean/tk7_cs_raven.jpg,http://web.mit.edu/pmwh/www/enfreakment-images/clean/tk7_pr_raven.png,http://web.mit.edu/pmwh/www/enfreakment-images/clean/tk7_ig_raven.jpg,Unknown,women,"As an agent for the UN's intelligence bureau, Master Raven embarked on her latest top-secret mission: Infiltrate the King of Iron Fist Tournament and confront her assigned target. In the frozen area that was to be her battleground, Master Raven stood, arms folded, face to face with her subordinate's sworn enemy, who simply narrowed his eyes and took up a fighting pose.","It's just business. Don't take it personally.",luckychloe,Lucky Chloe,Lucky Chloe's,http://web.mit.edu/pmwh/www/enfreakment-images/clean/tk7_cs_luckychloe.jpg,http://web.mit.edu/pmwh/www/enfreakment-images/clean/tk7_pr_luckychloe.png,http://web.mit.edu/pmwh/www/enfreakment-images/clean/tk7_ig_luckychloe.jpg,Unknown,women,"Lucky Chloe is a pop sensation, and the face of the G Corporation brand. When a mysterious man burst into G Corp and took out guard after guard with dance-like techniques, Lucky Chloe fearlessly walked right up to him and blocked his path. She threw the man one of her trademark smiles and issued him a challenge: Fight her, and if he loses he'll have to work as her backup dancer! Without caring if he'd accepted the conditions or not, she prepared for battle.","Are you ready?",m_bison,M. Bison,M. Bison's,http://web.mit.edu/pmwh/www/enfreakment-images/clean/sfv_cs_m_bison.jpg,http://web.mit.edu/pmwh/www/enfreakment-images/clean/sfv_oa_m_bison.jpg,http://web.mit.edu/pmwh/www/enfreakment-images/clean/sfv_ig_m_bison.jpg,Unknown,men,"If there’s one character in the Street Fighter universe that can be described as pure evil, it has to be M. Bison. Brainwashing, human experimentation and remorseless murder, there’s nothing this dictator won’t do to fulfil his ambitions.","Bow down before my Psycho Power!",alisa,Ailsa Bosconovitch,Alisa's,http://web.mit.edu/pmwh/www/enfreakment-images/clean/tk7_cs_alisa.jpg,http://web.mit.edu/pmwh/www/enfreakment-images/clean/tk7_pr_alisa.png,http://web.mit.edu/pmwh/www/enfreakment-images/clean/tk7_ig_alisa.jpg,Russia,women,"An android created by Dr. Bosconovitch as a bodyguard for Jin Kazama. Her design itself is modeled after Bosconovitch's own lost daughter. Her fighting capabilities are extremely high. She can perform attacks with high mobility using arm-mounted missiles and thrusters.","I am Alisa, nice to meet you"
lili,Emilie 'Lili' De Rochefort,Lili's,http://web.mit.edu/pmwh/www/enfreakment-images/clean/tk7_cs_lili.jpg,http://web.mit.edu/pmwh/www/enfreakment-images/clean/tk7_pr_lili.png,http://web.mit.edu/pmwh/www/enfreakment-images/clean/tk7_ig_lili.jpg,Monaco,women,"Lili entered the King of Iron Fist Tournament again without telling her father this time either. There she was anyway, smiling as the rapturous crowd looked on and her opponent entered the arena. Lili was set to fight Asuka Kazama, someone she had personally considered her greatest rival for many years. If Lili saw the look of annoyance on Asuka's face, it didn't show; she just walked elegantly to the center of the ring like she owned it, all the while thanking Lady Luck for the opportunity to fight her rival.","You surely don't believe… you can beat me?",r_mika,R. Mika,R. Mika's,http://web.mit.edu/pmwh/www/enfreakment-images/clean/sfv_cs_r_mika.jpg,http://web.mit.edu/pmwh/www/enfreakment-images/clean/sfv_oa_r_mika.jpg,http://web.mit.edu/pmwh/www/enfreakment-images/clean/sfv_ig_r_mika.jpg,Japan,women,"First appearing in Street Fighter Alpha 3, Rainbow Mika is a pro wrestler who idolises Zangief. Many of her special moves are exaggerated versions of real-life wrestling techniques.","I'll kick your ass! All right! Let's begiiiin!!!",nina,Nina Williams,Nina's,http://web.mit.edu/pmwh/www/enfreakment-images/clean/tk7_cs_nina.jpg,http://web.mit.edu/pmwh/www/enfreakment-images/clean/tk7_pr_nina.png,http://web.mit.edu/pmwh/www/enfreakment-images/clean/tk7_ig_nina.jpg,Ireland,women,"After failing to apprehend Jin Kazama, Nina Williams decided it was time for her and the Mishima Zaibatsu to go their separate ways. On her first private assassination job, she was tasked with infiltrating a mafia wedding… posing as the bride! During the ceremony, a firefight broke out where Nina took out all her targets. However, the commotion had attracted the Tekken Force, who had been dispatched to suppress the violence, and they gave chase. With the Tekken Force in hot pursuit, Nina made her escape. That's when she bumped into a man she found vaguely familiar. The man wouldn't leave her alone. He seemed to have something he wanted to say to her… Nina decided that a confrontation was her best chance of escape.","You've got a date with death.",deviljin,Devil Jin,Devil Jin's,http://web.mit.edu/pmwh/www/enfreakment-images/clean/tk7_cs_deviljin.jpg,http://web.mit.edu/pmwh/www/enfreakment-images/clean/tk7_pr_deviljin.png,http://web.mit.edu/pmwh/www/enfreakment-images/clean/tk7_ig_deviljin.jpg,Unknown,men,"After he defeated Azazel, Jin Kazama was apprehended by UN troops. As his unconscious body was being transported by helicopter, he became possessed by his devil form, ripped free from his straitjacket, tore through the helicopter's fuselage with a powerful beam attack, and then escaped. Intermittently fending off the UN's attempts to recapture him, Devil Jin wandered the desert until he stumbled across a town in the Middle East. His arrival at the town's bazaar sent the civilians fleeing for their lives, turning the once buzzing settlement into an abandoned husk. That is until a certain someone showed his face…","Fear my wrath.",leo,Leo Kliesen,Leo's,http://web.mit.edu/pmwh/www/enfreakment-images/clean/tk7_cs_leo.jpg,http://web.mit.edu/pmwh/www/enfreakment-images/clean/tk7_pr_leo.png,http://web.mit.edu/pmwh/www/enfreakment-images/clean/tk7_ig_leo.jpg,Germany,men,"Leo entered the King of Iron Fist Tournament in the hope of uncovering more about his deceased mother, who had been a researcher for the Mishima Zaibatsu. When Leo learned that his battle arena was to be a Zaibatsu-owned dojo, he couldn't believe his luck. However, when he got there, the dojo was in ruin. The moonlight poured in through holes in the walls and roof, illuminating the floor with an eerie beauty. A short while later, a strange, floating silhouette appeared, and slowly glided toward Leo. The silhouette held a sword in its left hand that rotated at a mind-bending speed. What the hell was this thing? It looked like some kind of a flying squid or octopus! Was it a demon…? Then it finally dawned on Leo: This bizarre creature was his opponent. Cautiously, he prepared to fight.","Get ready!"
r_mika,R. Mika,R. Mika's,http://web.mit.edu/pmwh/www/enfreakment-images/clean/sfv_cs_r_mika.jpg,http://web.mit.edu/pmwh/www/enfreakment-images/clean/sfv_oa_r_mika.jpg,http://web.mit.edu/pmwh/www/enfreakment-images/clean/sfv_ig_r_mika.jpg,Japan,women,"First appearing in Street Fighter Alpha 3, Rainbow Mika is a pro wrestler who idolises Zangief. Many of her special moves are exaggerated versions of real-life wrestling techniques.","I'll kick your ass! All right! Let's begiiiin!!!",urien,Urien,Urien's,http://web.mit.edu/pmwh/www/enfreakment-images/clean/sfv_cs_urien.jpg,http://web.mit.edu/pmwh/www/enfreakment-images/clean/sfv_oa_urien.jpg,http://web.mit.edu/pmwh/www/enfreakment-images/clean/sfv_ig_urien.jpg,Unknown,men,"First introduced in Street Fighter III: Second Impact, Urien is the vice president of the Illuminati. Unlike his benevolent brother, this self-serving tyrant is only interested in furthering his own interests.","Don't worry. I'll end you quickly.",jack7,Jack-7,Jack-7's,http://web.mit.edu/pmwh/www/enfreakment-images/clean/tk7_cs_jack7.jpg,http://web.mit.edu/pmwh/www/enfreakment-images/clean/tk7_pr_jack7.png,http://web.mit.edu/pmwh/www/enfreakment-images/clean/tk7_ig_jack7.jpg,Russia,men,"It was no secret that G Corporation was locked in a power struggle with the Mishima Zaibatsu. However, within G Corp itself, another battle was raging: the battle to create the ultimate next-gen humanoid weapon. On one side was the development team behind the Jack series led by Jane; on the other was the research team responsible for Gigas, a bio-enhanced super human. With his massive size and uncanny mobility, Gigas was hailed for his versatility in combat, and some saw him as more than capable of dislodging the Jack series from its position as G Corp's premier weapon. Both teams entered their weapons into the King of Iron Fist Tournament to decide once and for all which was the best.","…",zeku,Zeku,Zeku's,http://web.mit.edu/pmwh/www/enfreakment-images/clean/sfv_cs_zeku.jpg,http://web.mit.edu/pmwh/www/enfreakment-images/clean/sfv_oa_zeku.jpg,http://web.mit.edu/pmwh/www/enfreakment-images/clean/sfv_ig_zeku.jpg,Japan,men,"First appearing in Guy's ending for Street Fighter Alpha II, Zeku is the 38th successor of Bushinryu. Using a special ninja technique, he can reverse his aging to become young again.","Lets party! If you think you can keep up.",vega,Vega,Vega's,http://web.mit.edu/pmwh/www/enfreakment-images/clean/sfv_cs_vega.jpg,http://web.mit.edu/pmwh/www/enfreakment-images/clean/sfv_oa_vega.jpg,http://web.mit.edu/pmwh/www/enfreakment-images/clean/sfv_ig_vega.jpg,Spain,men,"As perhaps the most narcissistic man in the Street Fighter universe, Vega dresses like a matador but fights like a ninja. He cares only for beauty and despises anyone he considers ugly.","Let my beauty intoxicate you."
birdie,Birdie,Birdie's,http://web.mit.edu/pmwh/www/enfreakment-images/clean/sfv_cs_birdie.jpg,http://web.mit.edu/pmwh/www/enfreakment-images/clean/sfv_oa_birdie.jpg,http://web.mit.edu/pmwh/www/enfreakment-images/clean/sfv_ig_birdie.jpg,United Kingdom,men,"With a history that dates back to the original Street Fighter, Birdie’s appearance has changed dramatically over the years. He’s gone from being a muscular brute in the Alpha series to a beer bellied glutton in Street Fighter V.","Oi! It ain't too late to run home to Mum, now!",vega,Vega,Vega's,http://web.mit.edu/pmwh/www/enfreakment-images/clean/sfv_cs_vega.jpg,http://web.mit.edu/pmwh/www/enfreakment-images/clean/sfv_oa_vega.jpg,http://web.mit.edu/pmwh/www/enfreakment-images/clean/sfv_ig_vega.jpg,Spain,men,"As perhaps the most narcissistic man in the Street Fighter universe, Vega dresses like a matador but fights like a ninja. He cares only for beauty and despises anyone he considers ugly.","Let my beauty intoxicate you.",kazumi,Kazumi Mishima,Kazumi's,http://web.mit.edu/pmwh/www/enfreakment-images/clean/tk7_cs_kazumi.jpg,http://web.mit.edu/pmwh/www/enfreakment-images/clean/tk7_pr_kazumi.png,http://web.mit.edu/pmwh/www/enfreakment-images/clean/tk7_ig_kazumi.jpg,Japan,women,"Kazumi Mishima, wife of Heihachi Mishima, is well versed in Hachijyo Karate. She was childhood friends with her husband Heihachi and eventually they fell in love. Through their love they birthed a healthy young boy. Fast forward a few years later, Heihachi would become the head of a huge organization called the Mishima Zaibatsu, with plans to conquer the world. Kazumi loved Heihachi unconditionally, but at the same time he was beginning to feel dangerous. In this state, Heihachi threw the world into a war and Kazumi took it upon herself to stop him.","I will teach you the meaning of fear.",deviljin,Devil Jin,Devil Jin's,http://web.mit.edu/pmwh/www/enfreakment-images/clean/tk7_cs_deviljin.jpg,http://web.mit.edu/pmwh/www/enfreakment-images/clean/tk7_pr_deviljin.png,http://web.mit.edu/pmwh/www/enfreakment-images/clean/tk7_ig_deviljin.jpg,Unknown,men,"After he defeated Azazel, Jin Kazama was apprehended by UN troops. As his unconscious body was being transported by helicopter, he became possessed by his devil form, ripped free from his straitjacket, tore through the helicopter's fuselage with a powerful beam attack, and then escaped. Intermittently fending off the UN's attempts to recapture him, Devil Jin wandered the desert until he stumbled across a town in the Middle East. His arrival at the town's bazaar sent the civilians fleeing for their lives, turning the once buzzing settlement into an abandoned husk. That is until a certain someone showed his face…","Fear my wrath.",ken,Ken,Ken's,http://web.mit.edu/pmwh/www/enfreakment-images/clean/sfv_cs_ken.jpg,http://web.mit.edu/pmwh/www/enfreakment-images/clean/sfv_oa_ken.jpg,http://web.mit.edu/pmwh/www/enfreakment-images/clean/sfv_ig_ken.jpg,United States of America,men,"Heir to the Masters family fortune, Ken is a flamoyant fighter who learned the art of Ansatsuken from Gouken. He also grew up alongside Ryu, a man he considers both his best friend and ultimate rival.","Come on, let's turn up the heat."
