id1,name1,namepossessive1,imageA1,imageB1,imageC1,country1,gendergroup1,bio1,quote1,id2,name2,namepossessive2,imageA2,imageB2,imageC2,country2,gendergroup2,bio2,quote2,id3,name3,namepossessive3,imageA3,imageB3,imageC3,country3,gendergroup3,bio3,quote3,id4,name4,namepossessive4,imageA4,imageB4,imageC4,country4,gendergroup4,bio4,quote4,id5,name5,namepossessive5,imageA5,imageB5,imageC5,country5,gendergroup5,bio5,quote5
menat,Menat,Menat's,http://web.mit.edu/pmwh/www/enfreakment-images/clean/sfv_cs_menat.jpg,http://web.mit.edu/pmwh/www/enfreakment-images/clean/sfv_oa_menat.jpg,http://web.mit.edu/pmwh/www/enfreakment-images/clean/sfv_ig_menat.jpg,Egypt,women,"Making her Street Fighter debut, Menat is the apprentice of a famous fortune-teller. She fights with a crystal sphere that she controls with her soul power.","Have you considered your destiny? Do you believe in fate?",hwoarang,Hwoarang,Howarang's,http://web.mit.edu/pmwh/www/enfreakment-images/clean/tk7_cs_hwoarang.jpg,http://web.mit.edu/pmwh/www/enfreakment-images/clean/tk7_pr_hwoarang.png,http://web.mit.edu/pmwh/www/enfreakment-images/clean/tk7_ig_hwoarang.jpg,South Korea,men,"Hwoarang sees one man as his rival: Jin Kazama. Jin, CEO of the Mishima Zaibatsu, declared war against the world, and in the ensuing turmoil vanished suddenly, without a trace. Suspecting there is more to Jin's disappearance than meets the eye, Hwoarang vowed to track him down. With only a shred of reliable information at hand, he headed to the Middle East. After a series of dead leads, Hwoarang heard word that a demon had appeared in a town. Without a second thought, he got on his motorcycle and hammered down there. When he arrived, the place had been deserted, save for Jin Kazama in his devil form.","Come at me! I'll take you down.",necalli,Necalli,Necalli's,http://web.mit.edu/pmwh/www/enfreakment-images/clean/sfv_cs_necalli.jpg,http://web.mit.edu/pmwh/www/enfreakment-images/clean/sfv_oa_necalli.jpg,http://web.mit.edu/pmwh/www/enfreakment-images/clean/sfv_ig_necalli.jpg,Unknown,men,"As one of the four new characters introduced in Street Fighter V, much of Necalli’s past is shrouded in mystery. His fighting style is best described as animalistic, due to his feral slashes and stomps.","Devour-our-our…",ibuki,Ibuki,Ibuki's,http://web.mit.edu/pmwh/www/enfreakment-images/clean/sfv_cs_ibuki.jpg,http://web.mit.edu/pmwh/www/enfreakment-images/clean/sfv_oa_ibuki.jpg,http://web.mit.edu/pmwh/www/enfreakment-images/clean/sfv_ig_ibuki.jpg,Japan,women,"First appearing in Street Fighter III: New Generation, Ibuki is a Japanese kunoichi and highschool student. She finds her ninja training tedious, preferring to slack off with her pet racoon dog, Don-chan.","I will finish this in no time!",katarina,Katarina Alves,Katarina's,http://web.mit.edu/pmwh/www/enfreakment-images/clean/tk7_cs_katarina.jpg,http://web.mit.edu/pmwh/www/enfreakment-images/clean/tk7_pr_katarina.png,http://web.mit.edu/pmwh/www/enfreakment-images/clean/tk7_ig_katarina.jpg,Brazil,women,"Katarina Alves lost both her parents at a young age, and spent several years at an orphanage before being adopted by a man she'd never met. Initially, Katarina rebelled against him using a whole manner of profane language, but the man's kindness and patience eventually wore her hard exterior down. In time, they grew close, though her penchant for profane language remained. One day, Katarina's adoptive father vanished. As much as she wanted to find him, she lacked the money to do so. But then she learned of the King of Iron Fist Tournament. The savage techniques the man had taught her gave Katarina hope that she could win and take the cash prize. The day of the first match arrived, and the arena was none other than the roof of G Corporation's Millennium Tower. When Katarina first laid eyes on her opponent, all she saw was an enormous hulk of muscle. There was no way he could be human…","Sorry, but you're gonna have to die."
jack7,Jack-7,Jack-7's,http://web.mit.edu/pmwh/www/enfreakment-images/clean/tk7_cs_jack7.jpg,http://web.mit.edu/pmwh/www/enfreakment-images/clean/tk7_pr_jack7.png,http://web.mit.edu/pmwh/www/enfreakment-images/clean/tk7_ig_jack7.jpg,Russia,men,"It was no secret that G Corporation was locked in a power struggle with the Mishima Zaibatsu. However, within G Corp itself, another battle was raging: the battle to create the ultimate next-gen humanoid weapon. On one side was the development team behind the Jack series led by Jane; on the other was the research team responsible for Gigas, a bio-enhanced super human. With his massive size and uncanny mobility, Gigas was hailed for his versatility in combat, and some saw him as more than capable of dislodging the Jack series from its position as G Corp's premier weapon. Both teams entered their weapons into the King of Iron Fist Tournament to decide once and for all which was the best.","…",kazuya,Kazuya Mishima,Kazuya's,http://web.mit.edu/pmwh/www/enfreakment-images/clean/tk7_cs_kazuya.jpg,http://web.mit.edu/pmwh/www/enfreakment-images/clean/tk7_pr_kazuya.png,http://web.mit.edu/pmwh/www/enfreakment-images/clean/tk7_ig_kazuya.jpg,Japan,men,"Kazuya was raised as the heir to the Mishima Zaibatsu, but rebelled against his father Heihachi. After awakening the power of the devil within him, he's finally able to control it.","It's time for you to meet your end!",karin,Karin,Karin's,http://web.mit.edu/pmwh/www/enfreakment-images/clean/sfv_cs_karin.jpg,http://web.mit.edu/pmwh/www/enfreakment-images/clean/sfv_oa_karin.jpg,http://web.mit.edu/pmwh/www/enfreakment-images/clean/sfv_ig_karin.jpg,Japan,women,"As a top contender for the wealthiest fighter in the Street Fighter universe, Karin Kanzuki is understandably snobbish. She also counts the likes of Sakura, Ken and R. Mika among her rivals.","I'll show you the divide in our class!",raven,Master Raven,Raven's,http://web.mit.edu/pmwh/www/enfreakment-images/clean/tk7_cs_raven.jpg,http://web.mit.edu/pmwh/www/enfreakment-images/clean/tk7_pr_raven.png,http://web.mit.edu/pmwh/www/enfreakment-images/clean/tk7_ig_raven.jpg,Unknown,women,"As an agent for the UN's intelligence bureau, Master Raven embarked on her latest top-secret mission: Infiltrate the King of Iron Fist Tournament and confront her assigned target. In the frozen area that was to be her battleground, Master Raven stood, arms folded, face to face with her subordinate's sworn enemy, who simply narrowed his eyes and took up a fighting pose.","It's just business. Don't take it personally.",xiaoyu,Ling Xiaoyu,Xiaoyu's,http://web.mit.edu/pmwh/www/enfreakment-images/clean/tk7_cs_xiaoyu.jpg,http://web.mit.edu/pmwh/www/enfreakment-images/clean/tk7_pr_xiaoyu.png,http://web.mit.edu/pmwh/www/enfreakment-images/clean/tk7_ig_xiaoyu.jpg,China,women,"Ling Xiaoyu infiltrated the Mishima Zaibatsu building in search of information relating to Jin Kazama's disappearance. Creeping deeper into the enemy territory under the guards' noses, she eventually hears Heihachi Mishima's voice coming from a room; he was giving orders about locating Jin. Just as Xiaoyu was about to sneak into the room, a man dressed all in white emerged and pushed her back. 'Take me to Jin!' Xiaoyu demanded, unflinching. The man stood there for a moment, before ordering Xiaoyu to follow him. He led her to the roof, then silently turned toward her, and readied himself to fight. Xiaoyu took up her fighting stance, and said, 'So that's how it is... If you think I'm just some little girl, you're sadly mistaken.'","I'm going to stop Jin!"
alisa,Ailsa Bosconovitch,Alisa's,http://web.mit.edu/pmwh/www/enfreakment-images/clean/tk7_cs_alisa.jpg,http://web.mit.edu/pmwh/www/enfreakment-images/clean/tk7_pr_alisa.png,http://web.mit.edu/pmwh/www/enfreakment-images/clean/tk7_ig_alisa.jpg,Russia,women,"An android created by Dr. Bosconovitch as a bodyguard for Jin Kazama. Her design itself is modeled after Bosconovitch's own lost daughter. Her fighting capabilities are extremely high. She can perform attacks with high mobility using arm-mounted missiles and thrusters.","I am Alisa, nice to meet you",bryan,Bryan Fury,Bryan's,http://web.mit.edu/pmwh/www/enfreakment-images/clean/tk7_cs_bryan.jpg,http://web.mit.edu/pmwh/www/enfreakment-images/clean/tk7_pr_bryan.png,http://web.mit.edu/pmwh/www/enfreakment-images/clean/tk7_ig_bryan.jpg,United States of America,men,"A savage fighter who uses a kickboxing fighting style. He's reported to have died twice and was somehow revived each time. He once belonged to an international police force, but Dr. Abel and Dr. Bosconovitch made him a replicant with a perpetual generator that keeps him alive.","Mwahahahaha! So, which one of you wants to die?",eddy,Eddy Gordo,Eddy's,http://web.mit.edu/pmwh/www/enfreakment-images/clean/tk7_cs_eddy.jpg,http://web.mit.edu/pmwh/www/enfreakment-images/clean/tk7_pr_eddy.png,http://web.mit.edu/pmwh/www/enfreakment-images/clean/tk7_ig_eddy.jpg,Brazil,men,"Eddy Gordo went to G Corporation to exact revenge on Kazuya Mishima for murdering his father. After he'd taken out a crowd of guards, a young girl in a strange outfit stood before him, and struck a pose. 'You're not getting past me, old man! Teehee!' What did she mean by 'old man'? Confused and irritated by her appearance and disrespectful tone, but aware of the threat she posed, Eddy prepared to fight.","Don't think I'll go easy on you.",zeku,Zeku,Zeku's,http://web.mit.edu/pmwh/www/enfreakment-images/clean/sfv_cs_zeku.jpg,http://web.mit.edu/pmwh/www/enfreakment-images/clean/sfv_oa_zeku.jpg,http://web.mit.edu/pmwh/www/enfreakment-images/clean/sfv_ig_zeku.jpg,Japan,men,"First appearing in Guy's ending for Street Fighter Alpha II, Zeku is the 38th successor of Bushinryu. Using a special ninja technique, he can reverse his aging to become young again.","Lets party! If you think you can keep up.",dragunov,Sergei Dragunov,Sergei's,http://web.mit.edu/pmwh/www/enfreakment-images/clean/tk7_cs_dragunov.jpg,http://web.mit.edu/pmwh/www/enfreakment-images/clean/tk7_pr_dragunov.png,http://web.mit.edu/pmwh/www/enfreakment-images/clean/tk7_ig_dragunov.jpg,Russia,men,"Sergei Dragunov entered the King of Iron Fist Tournament on army orders. At the designated arena of his first match, a woman appeared before him. There was something strangely familiar about her… It didn't take Dragunov long to figure out who she was, and he wasted no time in readying himself for combat.","…"
birdie,Birdie,Birdie's,http://web.mit.edu/pmwh/www/enfreakment-images/clean/sfv_cs_birdie.jpg,http://web.mit.edu/pmwh/www/enfreakment-images/clean/sfv_oa_birdie.jpg,http://web.mit.edu/pmwh/www/enfreakment-images/clean/sfv_ig_birdie.jpg,United Kingdom,men,"With a history that dates back to the original Street Fighter, Birdie’s appearance has changed dramatically over the years. He’s gone from being a muscular brute in the Alpha series to a beer bellied glutton in Street Fighter V.","Oi! It ain't too late to run home to Mum, now!",lars,Lars Alexandersson,Lars's,http://web.mit.edu/pmwh/www/enfreakment-images/clean/tk7_cs_lars.jpg,http://web.mit.edu/pmwh/www/enfreakment-images/clean/tk7_pr_lars.png,http://web.mit.edu/pmwh/www/enfreakment-images/clean/tk7_ig_lars.jpg,Sweden,men,"A former officer of the Mishima Zaibatsu's special military unit, the Tekken Force, Lars enacted a coup d'état and rebelled against his former employer. Lars continues to fight despite the loss of his fallen comrades, and his bloody rebellion is nowhere near finished.","Think you can stop me?",menat,Menat,Menat's,http://web.mit.edu/pmwh/www/enfreakment-images/clean/sfv_cs_menat.jpg,http://web.mit.edu/pmwh/www/enfreakment-images/clean/sfv_oa_menat.jpg,http://web.mit.edu/pmwh/www/enfreakment-images/clean/sfv_ig_menat.jpg,Egypt,women,"Making her Street Fighter debut, Menat is the apprentice of a famous fortune-teller. She fights with a crystal sphere that she controls with her soul power.","Have you considered your destiny? Do you believe in fate?",zangief,Zangief,Zangief's,http://web.mit.edu/pmwh/www/enfreakment-images/clean/sfv_cs_zangief.jpg,http://web.mit.edu/pmwh/www/enfreakment-images/clean/sfv_oa_zangief.jpg,http://web.mit.edu/pmwh/www/enfreakment-images/clean/sfv_ig_zangief.jpg,Russia,men,"Known as the Red Cyclone in his native Russia, Zangief is a living mountain of muscle who wrestles bears for fun. He first appeared in Street Fighter II with his signature spinning pile driver.","My iron body is invincible! So beware!",zeku,Zeku,Zeku's,http://web.mit.edu/pmwh/www/enfreakment-images/clean/sfv_cs_zeku.jpg,http://web.mit.edu/pmwh/www/enfreakment-images/clean/sfv_oa_zeku.jpg,http://web.mit.edu/pmwh/www/enfreakment-images/clean/sfv_ig_zeku.jpg,Japan,men,"First appearing in Guy's ending for Street Fighter Alpha II, Zeku is the 38th successor of Bushinryu. Using a special ninja technique, he can reverse his aging to become young again.","Lets party! If you think you can keep up."
raven,Master Raven,Raven's,http://web.mit.edu/pmwh/www/enfreakment-images/clean/tk7_cs_raven.jpg,http://web.mit.edu/pmwh/www/enfreakment-images/clean/tk7_pr_raven.png,http://web.mit.edu/pmwh/www/enfreakment-images/clean/tk7_ig_raven.jpg,Unknown,women,"As an agent for the UN's intelligence bureau, Master Raven embarked on her latest top-secret mission: Infiltrate the King of Iron Fist Tournament and confront her assigned target. In the frozen area that was to be her battleground, Master Raven stood, arms folded, face to face with her subordinate's sworn enemy, who simply narrowed his eyes and took up a fighting pose.","It's just business. Don't take it personally.",kazumi,Kazumi Mishima,Kazumi's,http://web.mit.edu/pmwh/www/enfreakment-images/clean/tk7_cs_kazumi.jpg,http://web.mit.edu/pmwh/www/enfreakment-images/clean/tk7_pr_kazumi.png,http://web.mit.edu/pmwh/www/enfreakment-images/clean/tk7_ig_kazumi.jpg,Japan,women,"Kazumi Mishima, wife of Heihachi Mishima, is well versed in Hachijyo Karate. She was childhood friends with her husband Heihachi and eventually they fell in love. Through their love they birthed a healthy young boy. Fast forward a few years later, Heihachi would become the head of a huge organization called the Mishima Zaibatsu, with plans to conquer the world. Kazumi loved Heihachi unconditionally, but at the same time he was beginning to feel dangerous. In this state, Heihachi threw the world into a war and Kazumi took it upon herself to stop him.","I will teach you the meaning of fear.",zeku,Zeku,Zeku's,http://web.mit.edu/pmwh/www/enfreakment-images/clean/sfv_cs_zeku.jpg,http://web.mit.edu/pmwh/www/enfreakment-images/clean/sfv_oa_zeku.jpg,http://web.mit.edu/pmwh/www/enfreakment-images/clean/sfv_ig_zeku.jpg,Japan,men,"First appearing in Guy's ending for Street Fighter Alpha II, Zeku is the 38th successor of Bushinryu. Using a special ninja technique, he can reverse his aging to become young again.","Lets party! If you think you can keep up.",leo,Leo Kliesen,Leo's,http://web.mit.edu/pmwh/www/enfreakment-images/clean/tk7_cs_leo.jpg,http://web.mit.edu/pmwh/www/enfreakment-images/clean/tk7_pr_leo.png,http://web.mit.edu/pmwh/www/enfreakment-images/clean/tk7_ig_leo.jpg,Germany,men,"Leo entered the King of Iron Fist Tournament in the hope of uncovering more about his deceased mother, who had been a researcher for the Mishima Zaibatsu. When Leo learned that his battle arena was to be a Zaibatsu-owned dojo, he couldn't believe his luck. However, when he got there, the dojo was in ruin. The moonlight poured in through holes in the walls and roof, illuminating the floor with an eerie beauty. A short while later, a strange, floating silhouette appeared, and slowly glided toward Leo. The silhouette held a sword in its left hand that rotated at a mind-bending speed. What the hell was this thing? It looked like some kind of a flying squid or octopus! Was it a demon…? Then it finally dawned on Leo: This bizarre creature was his opponent. Cautiously, he prepared to fight.","Get ready!",paul,Paul Phoenix,Paul's,http://web.mit.edu/pmwh/www/enfreakment-images/clean/tk7_cs_paul.jpg,http://web.mit.edu/pmwh/www/enfreakment-images/clean/tk7_pr_paul.png,http://web.mit.edu/pmwh/www/enfreakment-images/clean/tk7_ig_paul.jpg,United States of America,men,"When Paul Phoenix, the golden boy of the martial arts world, steps into the ring, the excitement in the crowd is palpable. But this time when his opponent's name rang over the arena's loudspeakers, he could only scratch his head in disbelief. It was Kuma… again! However, Kuma was nowhere to be seen. Word went round that the bear had dropped out of the tournament. The ring announcer informed the spectators of a last-minute change to the fight card. Relieved, Paul awaits the entrance of his long-anticipated human opponent…","I'll show you the power of the strongest in the universe… but not for free!"
leo,Leo Kliesen,Leo's,http://web.mit.edu/pmwh/www/enfreakment-images/clean/tk7_cs_leo.jpg,http://web.mit.edu/pmwh/www/enfreakment-images/clean/tk7_pr_leo.png,http://web.mit.edu/pmwh/www/enfreakment-images/clean/tk7_ig_leo.jpg,Germany,men,"Leo entered the King of Iron Fist Tournament in the hope of uncovering more about his deceased mother, who had been a researcher for the Mishima Zaibatsu. When Leo learned that his battle arena was to be a Zaibatsu-owned dojo, he couldn't believe his luck. However, when he got there, the dojo was in ruin. The moonlight poured in through holes in the walls and roof, illuminating the floor with an eerie beauty. A short while later, a strange, floating silhouette appeared, and slowly glided toward Leo. The silhouette held a sword in its left hand that rotated at a mind-bending speed. What the hell was this thing? It looked like some kind of a flying squid or octopus! Was it a demon…? Then it finally dawned on Leo: This bizarre creature was his opponent. Cautiously, he prepared to fight.","Get ready!",karin,Karin,Karin's,http://web.mit.edu/pmwh/www/enfreakment-images/clean/sfv_cs_karin.jpg,http://web.mit.edu/pmwh/www/enfreakment-images/clean/sfv_oa_karin.jpg,http://web.mit.edu/pmwh/www/enfreakment-images/clean/sfv_ig_karin.jpg,Japan,women,"As a top contender for the wealthiest fighter in the Street Fighter universe, Karin Kanzuki is understandably snobbish. She also counts the likes of Sakura, Ken and R. Mika among her rivals.","I'll show you the divide in our class!",rashid,Rashid,Rashid's,http://web.mit.edu/pmwh/www/enfreakment-images/clean/sfv_cs_rashid.jpg,http://web.mit.edu/pmwh/www/enfreakment-images/clean/sfv_oa_rashid.jpg,http://web.mit.edu/pmwh/www/enfreakment-images/clean/sfv_ig_rashid.jpg,Middle East,men,"Much like Dee Jay before him, Rashid is an enthusiastic fighter who's rarely seen without a smile on his face. He's also something of a gadget lover, as can be seen by the tornado-firing rucksack he carries on his back.","I'm Rashid of the turbulent wind. Remember the name well.",bryan,Bryan Fury,Bryan's,http://web.mit.edu/pmwh/www/enfreakment-images/clean/tk7_cs_bryan.jpg,http://web.mit.edu/pmwh/www/enfreakment-images/clean/tk7_pr_bryan.png,http://web.mit.edu/pmwh/www/enfreakment-images/clean/tk7_ig_bryan.jpg,United States of America,men,"A savage fighter who uses a kickboxing fighting style. He's reported to have died twice and was somehow revived each time. He once belonged to an international police force, but Dr. Abel and Dr. Bosconovitch made him a replicant with a perpetual generator that keeps him alive.","Mwahahahaha! So, which one of you wants to die?",hwoarang,Hwoarang,Howarang's,http://web.mit.edu/pmwh/www/enfreakment-images/clean/tk7_cs_hwoarang.jpg,http://web.mit.edu/pmwh/www/enfreakment-images/clean/tk7_pr_hwoarang.png,http://web.mit.edu/pmwh/www/enfreakment-images/clean/tk7_ig_hwoarang.jpg,South Korea,men,"Hwoarang sees one man as his rival: Jin Kazama. Jin, CEO of the Mishima Zaibatsu, declared war against the world, and in the ensuing turmoil vanished suddenly, without a trace. Suspecting there is more to Jin's disappearance than meets the eye, Hwoarang vowed to track him down. With only a shred of reliable information at hand, he headed to the Middle East. After a series of dead leads, Hwoarang heard word that a demon had appeared in a town. Without a second thought, he got on his motorcycle and hammered down there. When he arrived, the place had been deserted, save for Jin Kazama in his devil form.","Come at me! I'll take you down."
ryu,Ryu,Ryu's,http://web.mit.edu/pmwh/www/enfreakment-images/clean/sfv_cs_ryu.jpg,http://web.mit.edu/pmwh/www/enfreakment-images/clean/sfv_oa_ryu.jpg,http://web.mit.edu/pmwh/www/enfreakment-images/clean/sfv_ig_ryu.jpg,Japan,men,"By travelling the world to improve his fighting ability, Ryu is the embodiment of the world warrior spirit. He's been the poster boy of the Street Fighter series since its inception.","This is the path of destiny!",rashid,Rashid,Rashid's,http://web.mit.edu/pmwh/www/enfreakment-images/clean/sfv_cs_rashid.jpg,http://web.mit.edu/pmwh/www/enfreakment-images/clean/sfv_oa_rashid.jpg,http://web.mit.edu/pmwh/www/enfreakment-images/clean/sfv_ig_rashid.jpg,Middle East,men,"Much like Dee Jay before him, Rashid is an enthusiastic fighter who's rarely seen without a smile on his face. He's also something of a gadget lover, as can be seen by the tornado-firing rucksack he carries on his back.","I'm Rashid of the turbulent wind. Remember the name well.",vega,Vega,Vega's,http://web.mit.edu/pmwh/www/enfreakment-images/clean/sfv_cs_vega.jpg,http://web.mit.edu/pmwh/www/enfreakment-images/clean/sfv_oa_vega.jpg,http://web.mit.edu/pmwh/www/enfreakment-images/clean/sfv_ig_vega.jpg,Spain,men,"As perhaps the most narcissistic man in the Street Fighter universe, Vega dresses like a matador but fights like a ninja. He cares only for beauty and despises anyone he considers ugly.","Let my beauty intoxicate you.",asuka,Asuka Kazama,Asuka's,http://web.mit.edu/pmwh/www/enfreakment-images/clean/tk7_cs_asuka.jpg,http://web.mit.edu/pmwh/www/enfreakment-images/clean/tk7_pr_asuka.png,http://web.mit.edu/pmwh/www/enfreakment-images/clean/tk7_ig_asuka.jpg,Japan,women,"Daughter of the Kazama Traditional Martial Arts School and known as 'Gang Mediator' in her hometown. Ever since she involved herself in a certain street fight, Lili has viewed her as a rival. She knows that Jin Kazama is her cousin and vows to take him down.","When you resort to fighting, everyone loses.",zangief,Zangief,Zangief's,http://web.mit.edu/pmwh/www/enfreakment-images/clean/sfv_cs_zangief.jpg,http://web.mit.edu/pmwh/www/enfreakment-images/clean/sfv_oa_zangief.jpg,http://web.mit.edu/pmwh/www/enfreakment-images/clean/sfv_ig_zangief.jpg,Russia,men,"Known as the Red Cyclone in his native Russia, Zangief is a living mountain of muscle who wrestles bears for fun. He first appeared in Street Fighter II with his signature spinning pile driver.","My iron body is invincible! So beware!"
